doc_id,text,magazine,year,article_type,author,title
colonial_magazines_0362,"作家印象記-「무지개」의 張赫宙氏 朴明煥 이번 大邱로 갓다가 作家 張赫宙氏를 맛나고 도라 왓다. 張赫宙氏는 일즉이 雜誌 「改造」에 그의 出世作 「餓鬼道」를 發表한 以來 늘 繼續해서 東京文壇에 巨彈을 더지어 왓스며 그 뿐만 아니라 昨年부터는 東亞日報에 長篇 「무지개」를 連載하야 一世의 讚歎을 밧어 오든 터이며 내 또한 氏의 作品을 통하야 未知의 벗이지만 尊敬하고 그리워하여 오든 터이라 南遊의 이번 機會에 氏의 書齋를 찻기로 한 터이엇다. 張氏는 嚴格히 말하면 「무지개」 以前에는 朝鮮文壇과 疏遠하여 잇섯고 流離하여 잇섯다. 그는 조선글 以外의 語學을 가지고서 海外文壇에 첫 驥足을 펴든 이다. 그러나 일즉이 日本詩人 野口米次郞이 英國에 滯留할 때에 日本人임에도 不拘하고 『ヨネ 野口』로서 英吉利詩壇에 盛名을 날니어 現 日本詩壇에서 보다 훨신 더 그 名聲이 華麗하엿든 일이 잇섯다. 마치 張赫宙氏의 處地가 이 例와 類似하다. 그는 東京文壇에서는 至極히 重要한 또 무게잇는 地位에 處하여 잇스나 우리 文壇에는 그 보담 떠러저 잇는 늣김을 갓게 하나니 아마 이것은 氏의 作品이 흔히는 조선글로 우리들 機關에서 發表되지 안은데서 그 理由를 차즐 것이라 하겟다. 却說-지난 4月 中旬 京城을 떠날 臨時해서 張氏에 關한<252> 이약이가 筆者가 親近히 交際하는 사람사이에 각금 論議되엿다. 張氏에 대한 서울文壇의 評判은 區區하엿다. 그의 作品을 稱頌하느냐하면 一方에서는 惡評을 서슴치 안코하는 一群도 잇섯다. 이것은 어느 時代 어느 社會를 勿論하고 흔히 볼 수 잇는 現像이다. 特히 文壇에서 그것이 一層 尤甚함은 놀나지 안을 수 업는 事實이다. 그러나 이 批評과 世評의 對像이 될 人物에 대한 贊否는 一定한 基準이 슨 다음에 잇서야 올흘 일이다. 거기에는 漠然하게 흐르든 先入的 意見 惡意에서 또 親不親에서 오는 感情을 가지고 이약이한다면 삼가야 올흘 것이다. 우리가 흔히 볼 수 잇는 所謂 文學靑年 流의 毒舌 文壇에 野心을 불갓치 두고 타오르는 悶悶한 感情을 풀길이 업서 한갓 頭角을 낫타낸 文人의 出世를 흠望하는 남어지 嫉妬的 毒舌과 덥허 놋코의 辱說이라면 또한 同情할 餘地잇가슬 일이나 그러치 안코 余가 天下第一의 文人也라 하는 驕된 생각에서 나오는 일이라면 슬푸다 아니할 수 업다. 朝鮮의 藝術을 위하야 한사람의 才分잇는 이가 出現한다면 그를 鞭韃督勵하여 그를 우리의 꼿, 우리의 별노 萬人이 우러러보게 하여야 하지 안을가? 張赫宙氏는 大邱에서 出生하야 그곳에서 無名作家時代의 쓰라린 忍苦의 오랜 동안을 보낸 분이다. 다음에도 말하겟거니와 氏의 作品에는 鄕土味가 누구의 作보다도 豐富하고 흙과 흙 우에 사는 人間描寫에 가장 天分을 보임은 定評잇는 일이라 이것이 모다 嶺南一隅 大邱山川을 背景으로 하고 비지어 진 것 이엇다. 딴말이나 張氏는 서울에 䟽遠하다. 서울의 知己를 몃 사람가지지 못하엿다 한다. 그가 親히 아는 몃 사람 外는 大槪가 文章을 通해서거나 或은 書信往來로 親分을 맷고 잇다한다. 그를 앗기는 사람가운데 「書信派」로 懷月이 잇고 파인이 잇다. 나는 懷月의 傳言을 가지고 또 파인의 付托을 가지고 나의 大邱行을 期會 삼어서 그 곳 잇는 家妻의 慶州旅行을 張氏와 함께 기도한다는 소식을 밧고 張氏가 朝夕呼吸하는 그 鄕土味를 맛볼 겸 떠낫든 것이다. 4月 21日 大邱에 나린 翌日 아츰에 妻의 案內로 張氏를 訪問하엿다. 張氏의 住宅은 大邱에서 사흘에 한 번식 여는 市場附近 南山町에 잇다. 이 거리는 中産層의 居留區로 비가나리면 길이 진흙밧이 되는 곳이요 大路와 新作路사이 작은 언덕을 의지한 洞里인데 洞里 안에는 無數한 지럼길이<253> 交錯되여 잇섯다. 그리고 나의 宿所인 妻家와 距離가 隣接한 곳에 張氏집이 잇섯다. 普通집에 前面을 판장으로 連한 골목과 골목 모통이 집이엿다. 門 한편에는 氏의 名剌가 검게된 나무에 히게 붓허 잇섯스며 大門에는 어울니지 안을 만하게 큰 郵便受函의 쇠가 빗나고 잇섯다. 차짐에 應해서 主人公인 듯한 목소리가 나고 조금 잇다가 張氏가 門을 열고 나왓다. 나는 이 瞬間 그의 容貌와 體格이 미리 본 寫眞과 넘어 틀님에 놀낫다. 無論 寫眞과 實 人物이 틀니는 것은 흔히 經驗하는 事實이나 寫眞에 보히는 氏는 精力이 橫溢한 頑强한 男性美의 所有者임에 反하야 至極히 섬細한 體格을 가진 「世紀의 驕兒 蒼白한 인테리型」의 人物이엿다. 數 個月동안 病席에 누어 잇섯다는 氏는 얼골에 病色이 보혓다. 「야-지금 기다리고 잇섯슴니다. 어서 드러오십시요」하며 반가히 잡는 손은 몹시 부드럽고 땃듯하엿섯다. 나는 10年 古友를 맛난 것 갓흔 親愛를 늣겻다. 뒤를 따라 書齋 兼 寢室인 듯한 거는 房으로 드러갓다. 間半 넓히나 되는 房가운데 작으마한 圓卓을 격해놋코 主客 3人이 마조 대하고 안젓다. 東便들창을 등지고 안지 主人은 세루 朝鮮옷에 와이사쓰를 밧처입고 억죽억죽한 얼골에 蒼白한 빗을 띄우고 端正히 꿀코 안젓다. 나는 初面人事를 하는 둥 마는 둥하게 맛치고 室內周圍를 한번 살퍼 보앗다. 처음 가는 집의 生䟽한 室內風景을 살펴보는 것은 누구나 共通히 갓는 心理이겟지만 나의 興味를 한층 더 끌게 한 것은 年 一次 全國에 散在한 無名作家의 激烈한 競爭속에서 斷然 登場한 改造當選作家인 張氏의 文人書齋를 살피는데 잇다. 房 남쪽 벽을 의지해서 거의 꽉 채워진 書架의 書籍에 눈이 먼저 갓다. 지금 記憶되는 것은 社會思想講座, 社會問題에 관한 書籍을 爲始해서 맑스資本論, 新興文學全集 압튼·씽크레아의 小說集, 프로作家의 小說集 等이 第一 만히 눈에 띄이니 그가 作家로서 平日에 社會問題에 대한 關心이 큰 것을 짐작할 수 잇스며 作品 「權と云ふ男」以前의 傾向을 그것으로 얼마만큼 說明하엿슴에 새삼스럴 것이 업고 世界文學全集, 日本藝術派의 小說集과 몃 卷의 宗敎書籍이 異彩를 發하고 其他 漢書, 洋書 等外에 만흔 月刊雜誌가 잇섯는데 주로 改造, 文藝首都, 行動, 文藝 等이엿스며 書架 한구석 위에다 衾枕을 둥그랏케 올녀논 것이 微笑를 지우게 하엿다. 東北便구석에 테불을 놋코 그 우에 電燈스탠드와 筆硯과 잉크 原稿紙가 노혀잇고 一却의 椅子가 잇고 書架와 테불사이 天井 밋헤는<254> 風景畵가 걸녀 잇섯고 마루로 통한 北便門 엽벽에는 伊東深水의 石版原色畵가 붓터 잇섯스며 房 中央 검은 圓卓 우에는 「文藝」와 「行動」과 「改造」와 日刊新聞 東亞日報와 日文新聞 數種이 노혀 잇섯다. 室內는 三面으로 드러오는 照明으로 해서 퍽 밝엇다. 그리고 主人 張氏는 여윈 한편 팔을 각금 들엇다 노앗다 하면서 獨特한 慶尙道 악센트와 일본말을 석거 가면서 부드러운 微笑를 띄우고 조용조용히 이약이를 하고 안저 잇섯다. 얼마 잇다가 主人이 마루로 나가드니 곳 茶를 가지고 드러왓다. 洋式 茶器具에 日本番荼가 담겨 잇섯다. 그사이에 貴여운 4,5歲쯤 되는 男兒가 드러왓다. 「이 애가 子弟임니까.」 主人은 우스면서 그럿타고 한다. 나는 어린애를 무릅에 안첫는데 별노히 낫을 가리지 안코 안젓다가 나가버린다. 暫時 그이 家庭을 紹介하면 張氏은 今年에 年 30 벌서 女學校 단니는 딸을 爲始해서 3,4名의 男妹를 둔 家庭의 아버지요 위로는 年老한 兩親을 뫼시고 잇서 經濟的으로 一家를 統禦하는 中樞的 人物이다. 今日의 그가 多少 經濟的으로 潤澤하게 ",삼천리,1934,대담·좌담,朴明煥,作家印象記-「무지개」의 張赫宙氏
colonial_magazines_0363,"春園硏究 金東仁 緖言 우리는 過去에 잇서서 자랑할 만한 國家를 歷史的으로 가저 보지 못하엿다. 三國鼎立의 이전 시대는 정확한 긔록이 업스니 자세히 알 길이 업스나 三國時代부터 벌서 우리의 祖先의 비참한 력사는 시작되엿다. 北으로는 唐이며, 오랑캐들의 끈힘업는 침노와 南으로는 X의 건드림을 바드면서 안으로는 三國 서로 끼리끼리의 싸홈의 계속-한 때도 편안히 벼개를 노피하고 잠을 자본 일이 업섯다. 오늘날 서로 뭉처저서 2천 萬이라는 數를 이룬 朝鮮民族이라는 것은 三國時代에 잇서서는 5,6개의 나누어진 敵國이엇다. 正確한 記錄은 업스나 口傳에 의지한 記錄으로 상고하건대 三國分立과 三韓의 以前에는 한 뭉치에 뭉처진 民族이엇다. 그것이 어떤 經路를 밟엇는지 여러 國家로 分立되면서 어제까지는 형아 아우야 하든 同族끼리 서로 다투고 싸우고 그 싸홈의 勝利를 엇기 위하여서는 異族인 外國의 勢力까지도 빌기를 결코 주저하지 안헛다. 新羅의 三國統一 新羅가 三國을 統一한 뒤며, 그 뒤를 그대로 아슨 高麗朝를 지나서 李朝의 消滅을 보기까지 한 때도 外國을 굽어보거나 넘겨본 歷史가 업시 戰戰兢兢이 지낫다. 元을 숭보면서도 머리를 수기고 절한 高麗朝며 X를 업수히 녀기면서도 X軍에게<215> 全國을 짓밟히며 胡를 더렵게 보면서도 그 正朔을 밧들지 안치 못한 李氏에까지-過去의 우리의 歷史는 그들의 後孫인 今日의 우리들로 하여금 憤만을 이르키게 하는 것이엇다. 그러한 가운데서도 우리로 하여금 우리의 祖先에게 尊敬과 愛慕의 念을 禁치 못하게 하는 것이 잇스니, 그것은 卽 다른 것이 아니라 우리의 祖先의 훌륭한 藝術遺産이엇다. 藝術遺産 만약 이 藝術遺産만 업섯드면 우리는 이 우리의 貧弱햇든 祖先의 무덤에 침을 뱃기를 주저하지 안햇슬 것이다. 國家의 起伏이 자심햇스며, 그런 때마다 前 國家의 國民으로 하여금 祖國을 回想하는 길을 막는 手段으로서 前代의 遺産을 모도 업시해버렷스매, 藝術遺産이라야 豐富하지는 못하다. 深山에 잇는 寺院, 그 寺院에 殘存한 若干, 혹은 陵墓에 감초인 故人의 所持品, 또는 地中에 埋沒된 것 약간-이런 것이 우리가 藝術遺産으로서 우리의 祖先에게서 물려 바든 것이다. 量으로는 薄弱키 짝이 업는 것이다. 몃 번의 國體의 變動에 或은 파괴되고 혹은 燒失되고, 또는 流失, 被盜 온갓 파란을 격그면서도 그냥 殘存하여 잇는 數個의 藝術-그것은 우리들로 하여금 커다란 忴持로서 異民族에게 우리의 조상을 자랑할만한 근거가 되는 것이다. 量의 多少를 말함이 아니라, 그 質로서 우리의 조상은 그 當時의 다른 어떤 民族보다도 빼난 文化生活을 하엿다는 증거가 넉넉히 되므로... 彫刻에 잇서서, 繪畵에 잇서서, 또는 工藝에 잇서서 우리 조상은 가장 노픈 文化生活을 경영하엿다.<216> 이러한 最高水準의 文化生活을 경영한 우리의 조상이 後世에 남길만한 文學藝術은 웨 創造하지 못햇나? 創造치 못햇슬 것이 아니다. 創造는 하엿지만, 後人이 일허 버렷다고 박게는 생각할 수가 업다. 支那의 文字가 輸入되고 또 吏讀가 發明된 이상에는, 文學을 創造치 못하엿슬 까닭이 업다. 人生感情의 高等表現方式인 美術과 音樂을 가젓든 民族이, 비교적 단순한 表現方式인 文學을 못가젓슬 까닭이 업다. 高麗朝에 와서 著作된 金富軾의 三國史記와 一然의 三國遺史를 보면 거기는 歷史的 事實보다 傳統的 事實이라고 認定할 수박게 업는 이야기가 만히 잇다. 바보溫達의 이야기라든가 官昌의 이야기라든가 百結先生의 이야기라든가 이박게도 이와 近似한 자미잇는 이야기들은 實在한 史談이라기 보다 三國時代의 小說이 아닐가 추측된다. 三國時代의 小說이 전하고 전해서 高麗朝에 와서는 史上에 實在化하여 울리지 안헛나, 이러케 추측되는 점이 만타. 暗澹한 高麗朝 朝鮮民族의 藝術史上에 잇서서 가장 暗黑한 時代가 高麗朝엇다. 지금 市場의 商品으로 化해서 비싼 갑에 매매되는 高麗滋器가 高麗朝 藝術을 자랑하는 唯一의 증거품으로 남어 잇슬 뿐이다. 그 박게는 어떤 藝術을 가젓섯는지 想像도 허락하지 안는 배다. 李太祖가 李氏朝鮮을 建國한 뒤에 가장 苦心한 것은 高麗 愛國者 박멸이엇다. 그 手段으로서 高麗」를 想起할만한 物件은 모도 破壞하고 燒棄하엿다. 高麗朝의 文化의 긔념품은 李氏의 손으로 모도 부서 버렷다. 善竹橋가 남어 잇는 것이 웬 까닭인지 의심될 만치 「高麗내음새」를 이 세상에서 消滅시켜 버렷다. 今日의 소위 고려 그릇은 모도 李氏朝鮮 建國 以前에 흙 가운데 무첫든 물건이지 地面 上에 잇는 高麗物件은 李氏의 손에 殘滅되엿다.<217> 高麗의 美術, 文學 等도 이때에 이 秦始皇아닌 朝鮮始皇의 손에 흔적 업시 사라저 버렷슬 것이다. 이리하여 高麗朝는 朝鮮 藝術史 上에 「暗黑時代」라는 넉자를 적어 노코 지나갓다. 李氏朝鮮 李氏 朝鮮朝. 「龍飛御天歌」는 李氏朝鮮을 찬송하기를 强制하는 한낫 政畧的 時調에 지나지 못하다 하나, 政畧은 政畧으로 미루어 두고, 그 뒤에 숨은 藝術的 價値는 拒否할 수 업는 배다. 그러나 암담키 짝이 업는 李氏朝鮮이엇다. 李氏朝의 文獻이며, 製作品 等은 (兵火 몃 번에 多少間의 遺失은 잇다 하여도) 비교적 만히 남어 잇다. 그러나 500年間에 겨우 이것이엇든가. 500年이라는 세월은 짤지 안흔 셰월이다. 그 동안에 겨우 이것이엇든가. 金時習의 著作 數篇, 許筠의 著作 數篇, 金萬重의 著作 數篇, 朴趾源의 著作 數篇, 그 박 몃 가지-이것이, 李朝朝鮮文學의 全部이엇다. 其他 藝術에도 特筆할만한 것을 몃 개 남기지 못하엿다. 그 박게는 平民 압박하기와 양반 끼리끼리의 싸홈과 朱子學의 末端硏究로 500年間을 無爲히 보냇다. 그러나 三國時代부터 벌서 文章藝術의 도취경을 맛본 이 民族은 이러한 貧弱한 文學뿐으로는 만족을 할 수가 업섯다. 正本이며 그 作者까지도 알 수 업는 만코 만흔 平民文學이, 愛讀되고 愛聽된 크나큰 事實을 우리는 이저서는 안 된다.<218> 임진록, 춘향전, 심청전, 장화홍련전, 금송아지전, 흥부놀부전, 토끼전, 숙영낭자전 그 박 헤일 수 업스리 만치 만코 만흔 文學作品이 귀로, 눈으로, 이 民族의 새를 께어 다녓다. 文學을 사랑하고 文學에 대한 欲求心은 가지고 잇스나, 政治적 결함 때문에 文學의 指導者를 못가지고, 文學의 提供을 밧지 못한 이 民族의 새에는 正本도 알 수 업고 作者의 氏名도 알 수 업는 平民文學이 흘너 다녓다. 가장 배우기 쉬운 文字을 가지고, 그 우에 活版術까지 아는 이 民族이 그들의 愛讀하는 春香傳이며, 興夫傳의 原本에 의지한 寫本이나, 活版本을 가지지 못하고 그 原作者의 氏名까지 일허 버렷다 하는 것은 얼마나 참담한 일이냐? 이러구러 李氏朝도 그 終末이 가까웟다. 世態가 차차 복잡하여 가면서 外事多端 外國(西洋)文化의 輸入 等, 차차 어즈러워 가서 民間 事에 일일히 양반들이 간섭키가 힘들어 갓다. 아직 것 人生의 末技로서 수모 밧든 藝術도 차차 그 날개를 자유로히 퍼도 간섭할 사람이 업서젓다. 國初 李仁植 한 개의 慧星이 나타낫다. 菊初李仁植이엇다. 과연 慧星이엇다. 황냥한 朝鮮의 벌판에 文學이라는 씨를 뿌리고저 나타난 菊初는 「鬼의 聲」 「치악산」 「血淚」 等 몃 개의 씨를 뿌려 노코는 夭逝하엿다. 慧星과 가치 나타낫다가 慧星과 가치 사라젓다. 山間에 피엿든 한 개 名花, 그러나 樵夫들은 이 ",삼천리,1934,문예평론,金東仁,春園硏究
colonial_magazines_0364,頌三千里 沈熏 놉흔곳에 올라 이땅을 굽어보니 큰 봉오리와 적은 뫼뿌리의 어엿붐이여 아즈랑이 속으로 視線이 녹아드는 곳까지 옷뚝옷뚝 소삿다가는 구비저 달니는 勾配-네 품에 안켜 딍굴고십도록 아름답고나 소나무 감송감송 木覓의 둥어리는 젓물고 어루만지든 어머니의 허리와 갓고 三角山은 남의 압헤 뽑아든 武士의 칼끗 한번찌르면 먹장그름 쏘다질뜻이 아즉도 네 氣象이 凜凜도하다 에워싼 것이 바다로되 물결이 성내지안코 샘과 시내로 가늘게 수(繡)노앗건만 그물이 맑고 그바다 푸르러서 한목음 마시면 限100年이나 壽를 할 뜻 퐁퐁퐁 소사서는 넘처넘처 흘르는고나 한아버지 주무시는 저산기슭에 뻐꾹새 울어예며 긴밤을 직히네 사랑하는 그대여 당신도 도라가면은 저 언덕우에 고히고히 무더드리고 그발치에 나도 누어 깁흔 설옴 이즈오리다 박아지쪽걸머지고 떠나는 兄弟 거츠른 벌판에 강낭이(高梁)이식올 줍는 姊妹여 白骨이나마 이 흙 속에 돌아와 무치소서 오오 바라볼사록 아름다운 나의 江山이여<47>,삼천리,1929,시,沈熏,頌三千里
colonial_magazines_0365,"獨逸의 戰爭文學 伯林學人 전선으로부터의 전쟁시와 전쟁소설은 盛히 발표되고 있으나 그 작자의 대부분은 돌격대 작가며, 素人의 黨員들이다. 나치스의 기관지 『펠킷쉐·베오바하다아』가 黨의 예술가 헬무스·에일에 의해서 작곡된 軍歌集을 비평하고 있는데 『中尉와 五人의 兵丁』, 『無人地帶에서』, 『前線兵丁에의 편지』, 『勝利에 引導하는 總治』, 『우리들은 總統의 충실한 騎士라』 등의 표제로서 대략 그 내용을 알 수 있다. 이러한 歌曲自身은 매우 초보적인 졸작이다. 그러나 이와 같은 舊式인 전쟁시 외에 새로운 스타일의 주목할 만한 나치스의 전쟁문학이 있다. 이것은 확실히 國家文化會議와 게쯔벨스의 宣傳省에 의해서 助成養育된 것으로 이런 類의 작품은 黨의 여러 기관지에서 보게 된다. 우리들은 그 전형으로서 다음의 두 가지 작품을 들 수가 있다. 즉, 주목할 오랜 나치스 작가의 一人인 막크스·융니겔의 『푸라-그에서 일어난 일』은 인간적인 방면을 강조하면서 獨逸의 젊은 정찰대를 묘사했다. 또 하나는 헬만·베고푸의 『雙兒의 果物』인데 이 작품은 젊은 獨逸병정이, 정복된 포-랜드의 토지와 농작물과 가축에 대하여 깊은 사랑을 나타낸 情景을 취급했다. 그는 대지에 접촉하여 小麥의 맛을 보며, 전쟁이 끝나며 이 새로운 토지에 移住할 기쁨을 말했다. 그는 소를 가지고 다루는 포-랜드의 백성의 여자를 도아준 후에 伏兵에게 사격 받는다. 이런 類의 문학은 의심할 것도 없이 人民다운데 뿌리깊게 끼쳐서 있는 전쟁을 회피하고 싶어하는 기분에 대항하여 이것과 싸우려는 것이며, 또한 그 목적은 나치스가 평화를 사랑하고 있는 것을 나타내려고 하는 것에 다를 것이 없다.<208> 나치스의 社會文學 그 외에 公認의 나치스 文學政策에는 우리들의 注目에 값이 될 또 하나의 경향이 있다. 그것은 겨우 시작된 것에 불과하지만 그러나 그 발전은 文學的과 동시에 政治的인 흥미를 가지고 있다. 「勞働前線」의 지도자들은 그 정치논문에 있어서 부자에게 대한 貧者의 국가 사회주의적인 싸움을 강조하고 있으나 나치스의 黨기관지와 문화기관은 최근에 이르러 이것들의 정치논문과 步調를 合하여 문학의 세계에 있어서도 사회적인 기조며 혁명적인 테-마를 盛히 장려하고 있다. 이 점으로 나치스 關係의 출판물이 사회적인 소설을 환영하고 있는 것은 주목할 현상이라고 말하지 않을 수 없다. 예컨대, 黨의 기관지 『펠킷쉐·베오바하다아』는 현재 사회혁명적인 테-마를 가진 두 개의 소설을 게재하고 있는데 第一의 키린·엔갓사아의 『原因』은 15세기의 지주와 교회정치에 대한 獨逸농민의 혁명을 취급하고 있으며, 第二의 막크스·떼-나아드의 『一勞働者』는 빵과 노동조건의 향상과 사회정의의 확립에 대한 獨逸 노동자의 투쟁을 묘사하고 있다. 나치스의 公認出版社 푸란쯔·에-야아社는 그 近刊 예고 중에 빈농의 생활과 투쟁, 노동계급의 생활, 1848년의 혁명들을 취급한 네 책의 소설을 加하였다. 히틀러 청년단 주최의 軍歌콩쿨의 하나로 상금을 획득한 詩는 『돈주머니보다도 노동을, 황금보다도 피를...』 라는 스로-간으로 끝마췄다. 이러한 슬로-간은 파시스트 정부에 있어서 매우 위험한 것이지만 그러나 獨逸文學이 이러한 주요한 전환기에 있는 것은 크게 우리들의 주목을 끄는 현상이다. (끝)<209> <208-209>",삼천리,1940,문예평론,伯林學人,獨逸의 戰爭文學
colonial_magazines_0366,"더 안된 것 더 안된 것 어머니 「너 기차 안에서 빠나나 껍질을 막우 내버리지 아느니 참으로 착한 아이이다. 그 껍질을 어찌 햇니? 네 주머니 속에 너헛니?」 순회 「아니, 악가 여기 여페 안젓든 양복쟁이 호주머니 속에 살그머히 너헛서요!」 어머니 「...」 잘못 탓소 3등 객차 안에서 구세군 한 사람이 매우 공손치 못한 말씨로 겨테 잇는 승객다려 「당신은 천당으로 갈 생각 아니하오?」 하니까 승객 「당신은 어찌 하려오?」 하고 반문. 구세군 「나 말이오. 나는 물론 천당으로 가지오.」 승객 「그러면 잘못 타섯소. 다음 정거장에서 밖구어 타시오. 이 차는 奉天行이랍니다.」 구세군 「음 ...」 外上으로 걸인 「한 푼 적선합쇼.」 주인 「1원짜리 밖에 없는데... 거슬를 돈 잇나?」 걸인 「없읍니다.」 주인 「99錢을 거슬러 주면 이 돈을 주겟는데.」 걸인 「나리닙. 이러케 하십시다. 지금부터 아흔 아홉 번 宅으로 구걸을 하러 올 터이니 주시지 마시고 지금 그 1원을 주십시오.」 주인 「입맛만 다신다!」 <77> <77>",삼천리,1933,잡저,Unknown,더 안된 것
