doc_id,text,magazine,year,article_type,author,title
colonial_magazines_0256,"崔英淑女士의 남긴 日記 故 崔英淑女士의 遺稿로는 紀行文, 수필, 英詩, 日記 등등 적지않게 잇으나 지금은 그의 遺稿가 四方에 흐터저 잇는 까닭에 수습중이라고 한다. 이것은 그의 日記가운데서 그때 그때에 詩의 형식으로 적어놓은 것을 二三소개하는 것이다. 그가 참으로 하고 싶어한 말은 우리의 萬부득이한 사정으로 소개할 수 없으니 유감이다. (一記者) 1930년 2월 1일 Tutta Ross를 생각하면서 心琴을 울리우는 가는 멜로디 네 어찌 그리 힘이 큰가? 옛날 따윗王의 거문고 소리는 사을의, 딸 미갈의 사랑을 삿고 波蘭 파데렙스키는 멜로디소리로 波蘭民의 간장을 征服한 대통령이라. 아! 멜로디의 힘이어 강철을 녹이는 불의 힘이어 높은 장벽 굳은 城廓을 파괴 정복하는 예리고를 巡回하든 라발 소리다. 네힘은 영웅壯士의 심장을 떨리우고 옛날 楚나라 軍人의 눈물을 짜내엇도다. 약하고도 강한 그 힘은 오직 멜로디로다. 어여쁜 처녀여! 진흙 물에 우뚝 돋아나온 어엽뿐 연꽃 봉오리같이 빈한의 주림속에 자라난 처녀여! 아름답기도하다. 굽실굽실 金실머리 갸름한 얼골을 돌린것이<38> 名書를 장식한 사진들 같이 얼골에 테를 들럿고나. 너의 귀염성잇는 턱이어 조그만 연주같은 입 도화같이 피어오는 두뺨 샛별같이 반짝이는 큼직한 눈 아! 처녀여! 아름답도다. 숩속에 깊이 숨엇든 장미화 봄바람에 눈을 떠 사방에 향기를 뿌리도다. 1930년 4월 1일 죽엄이어! 인생의 모든 神秘를 홀로 감춘 知慧의 神이어! 너는 인생의 周圍를 둘러싼 모든 문제를 해결하랴고 애씀을 보고 웃으리라. 죽엄! 그는 삶을 해석하는 유일의 方途일다. 죽엄을 맛보기전엔 모든 문제를 해결치못한다. 오! 죽엄의 神이어! 生의 困한 이몸을 속히 그대의 품에 안어 주소서. 1930년 4월 2일 세상에 第一 빠른 것이 무엇이냐? 공중의 솔개이냐? 화살이냐? 기차이냐? 비행기이냐? 다 速하다. 그러나 思想만치는 速할 수 없다. 나는 지금 책상우에 사회구제란 책을 보고 잇다. 10분이 지나지 못한 그동안에 나의 思想은 멀리 東天하날 끝 ××에 돌아갓다가 왓다. 思想은 과연 빠른 것이다. 10분동안에 朝鮮의 乞人들을 모와놓고 노동의 神聖을 가라치며 크나큰 작업장을 열어 놓고 그들에게 일을 주엇다. 이 어찌 速하지 않을 것이냐?<39> <38-39>",동광,1932,문예기타,Unknown,崔英淑女士의 남긴 日記
colonial_magazines_0257,"謹告 이번호가 다소 늦게 나오게 된 데 대하야 먼저 사죄의 말슴을 드립니다. 준비는 진작 해놓고도 의외에 만부득이한 사정으로 좀 늦게 되엇습니다. 애독자 제위께서는 海諒하여 주실줄 믿습니다. 세계풍운은 바야흐로 濃熱하여 가는 이때에 본지는 그 진상을 捕捉하기에 최대의 노력을 하엿습니다. 「歐羅巴의 낡은 腫處」 「經濟解說六題」 「內外大觀」은 세계대세를 말하는 인사의 반드시 일독할 만한 대문자요 「朝鮮日誌」는 조선사람의 현상을 아는데 일자료가 될 줄 믿습니다. 세계의 이목은 중국으로 모엿으니 「中國을 中心으로 한 列强의 動態」와 특히 上海事件을 중심으로 한 「上海事件特輯」과 「經濟封鎖는 實現될까」는 애독하실 가치가 잇다고 생각합니다. 이번호에는 청춘을 중심으로 취급하여 보앗습니다. 청춘, 청춘의 노래는 힘의 노래가 아닐까요. 열정의 노래가 아닐까요. 詩聖 괴테가 永眠한지 백년, 이제 그의 百年祭를 당하야 충분한 지면을 할애하지 못한 것은 유감입니다. 그러나 지면의 관계상 할수 없엇습니다. 東光大學은 지면의 관계상 휴강하지 않을 수 없엇으나 이제부터는 實益과 독자의 열망에 副하기 위하야 해설적 강좌를 계속하기로 하엿습니다. 이번호에 실리기로 준비되엇든 「舊韓國臨終日誌」 - 韓靑山, 「出獄六人移動座談會」 「日米戰爭을 準備하라」- 밋철 장군과 李仁, 咸尙勳 양씨의 「經濟封鎖實施與否」를 어쩔수 없는 사정으로 全文을 다 못실리게 되엇습니다. 필자와 독자께 아울러 사죄합니다. 제1회 中等學生作品競技大會는 학생제군의 열열한 지지와 선생제위의 부단한 성원으로 원만히 폐회하게 되엇습니다. 충심으로 감사의 뜻을 표하는 동시에 이번 대회로 말미아마 학생계에 일대충동을 이르키고 소기의 목적을 達할 수 잇은 것은 근래의 快事입니다. 본사는 학생제군의 요망에 의하야 제2회 대회를 개최하기로 하엿으니 一層 지지하여 주십시오. 전조선 10대 스포츠맨투표는 白熱戰을 연출하고 잇습니다. 10대운동가는 과연 누구누구? 4월호를 기다려주십시오. 2백원 현상발표도 4월호에 잇겟습니다. 2월호의 空前的 大大歡迎은 무어라고 감사의 말슴을 드릴지 모르겟습니다. 厚顧에 副하기 위하야 최상의 노력을 다할 따름입니다. 본호는 반드시 前號 이상으로 애독하여 주실 내용을 가젓다고 생각합니다. 애독자대중의 열렬한 지지는 본지 4월호로 하여금 어떠한 내용을 滿載하게 하엿는가? 준비는 다 되엇습니다. 여러분의 기대에 어그러지지 않을 것을 자신하고 잇습니다. 본사원 일동은 그 정력을 다하야 벌서 5월 창간기념특대호 준비에 분망중입니다. 별지 예고를 보시고 대중적 편집에 참가하십시오. 오늘 上海에서 온 친구의 말을 들으니 거기잇는 동포는 아직 다 잘잇다고 합니다. 來月 다시 뵈일 때의 세계는 어떠케 진전될려는지. 여러분 그러면 그때까지 안녕히 게십시오. 1832. 3월 1일. 東光社 一同 白",동광,1932,사고·편집후기,Unknown,謹告
colonial_magazines_0258,朝鮮과 徵兵制度 萬一 實施된다하면 동광사 設問 近者에 들으니 朝鮮에 徵兵제도를 실시하자는 說이 잇다고 하니 만일 徵兵제도가 실시된다고 假定하면 선생의 의견은 어떠하십니까. (회답도착순) 법률상으로 반대 변호사 金用茂 一. 朝鮮에 徵兵제도를 실시한다면의 假定 문제임으로 의견이 발표도 假定에 불과하나 爲先 정치방면으로 말하면 반대의 이유가 枚擧키 불능이지만 此를 姑捨하고 법률상 이유로만 말하야도 헌법상 인민에게 賦與한 자유 及 권리를 완전히 朝鮮존재의 인민이 享有치 못하는 今日에 잇어 徵兵제도만의 시행은 反對이외다. 반대합니다 천도교 朴浣 반대합니다. 그것은 다만 ××를 增員하는데에 불과함으로써이다. 局面을 凝視할 뿐 林元根 구체화될 것을 假定까지 하여가면서 억지로 거븍한 대답을 하고자 아니합니다. 오즉 그 추이되어가는 局面을 좀 더 지켜보지오. 이밖에 여러분께서 회답을 주섯으나 부득이한 사정으로 실리지 못하오니 海諒하시옵.<44>,동광,1932,설문,동광사,朝鮮과 徵兵制度 萬一 實施된다하면
colonial_magazines_0259,"稅金! 稅金!, 朝鮮租稅의 趨勢와 朝鮮人의 負擔 金佑枰 1. 우리는 稅金을 얼마나 내나? 1. 우리의 負擔은 重한가 輕한가? 1. 稅金은 늘어가나 줄어가나? 實生活과 緊切한 關係가 잇는 諸問題의 討論 1. 머릿말 個人의 살림사리에 相當한 金錢이 必要한 것같이 1國家政府의 살림사리에도 이에 相當한 金錢이 必要한 것이다. 個人은 그 生活資金을 求하되 財産과 職業에 依하며 이 두 가지로도 不足하다든지 或은 없다면 債金에 依하기도 한다. 國家政府도 個人과 같이 國家所有의 官有財産, 官營機關에서도 그 收入을 取할 뿐 아니라 個人으로서는 不可能한 租稅에 依하야 그 收入을 求하는 것이다. 然故로 租稅라는 것은 國家政府의 獨特한 收入資源이다. 財政的으로 獨特하며 國家政府 對 人民關係로 보아 獨特하다는 것이다. 卽 다시 말하자면 國家政府의 收入 卽 歲入 中 租稅라는 것은 經濟的으로 政治的으로 重大한 것이다. 웨 그러냐하면 租稅라는 것은 國家政府가 權力으로써 國民全體의 公共的 費用에 充當하기 爲하야 自國 內의 人과 物에 依하야 金錢的 負擔을 强要하는 때문이다. 그러므로 1國家 人民의 租稅負擔이란 것이 人民 그 自體의 生活에 至大한 關係가 잇다는 것이다. 이에 우리의 生活에 如斯히 至大한 關係를 가지고 잇는 朝鮮의 租稅를 論하야 보자. 勿論 租稅라하면 그 論點의 範圍가 廣大하니까 東光編輯人의 請에 依하야 特히 租稅의 種目과 그 金額을 論하기 爲하야 朝鮮租稅의 趨勢를 論하야 朝鮮人의 負擔을 指摘하랴 한다. 2. 租稅와 그 趨勢 朝鮮의 租稅體系를 考察하면 (1) 國稅, (2) 地方稅, (3) 府稅, (4) 面賦課金 等으로 分하여 잇다. (1) 國稅와 그 趨勢 그러면 國稅는 무엇을 가르침인가? (1) 地稅 (2) 所得稅 (3) 營業稅 (4) 資本利子稅 (5) 取引所稅 (6) 取引稅 (7) 鑛稅 (8) 酒稅 (9) 砂糖消費稅 (10) 印紙稅 (11) 登錄稅 (12) 朝鮮銀行券發行稅 等으로서 中央政府에 納入하는 稅들이다. 이에 此等 國稅 <35> 稅目에 依하야 그 趨勢를 論하건대 이러하다. (가) 地稅 地稅는 朝鮮稅制 中 가장 重要한 地位를 占領하엿다. 經濟的으로나 政治的으로 重要하다는 것이다. 經濟的으로 말하면 大正7年엔 稅額이 겨우 11,220,851圓이엇든 것이 昭和 4年度에는 一躍 15,665,074圓으로서 朝鮮稅額 中 第1位를 占領하엿으며 納稅 義務者數로 본다면 大正7年엔 3,374,279人이엇든 것이 昭和4年에 至하여는 4,006,667人이라 한다. 昭和 4年度 納稅義務者 中 日本人 86,858人과 外國人 2,087人을 除한다 하드라도 그 數는 吾人의 豫想보다도 過多하게 增加되엇다. 뿐만 아니라 納稅 義務者 納額 別 人員으로는 5百圓 以上 稅金을 納入하는 者로서 朝鮮人은 昭和4年度 統計에 依하야 364人인데 日本人은 525人으로서 斷然이 日本人의 數가 朝鮮人의 數보다 多하다는 것이다. 그리하야 朝鮮人口의 8割强이 農民이란 것을 이에 聯想한다면 政治的 으로 또한 重大性을 가젓다 아니할 수 없다. (나) 所得稅 所得稅란 것은 負擔公平이란 見地에서 比較的 進步된 稅制이라 한다. 이에 그 發達過程을 考察하건대 大正10年엔 겨우 786,346圓이엇든 것이 昭和4年度에는 1,301,460圓으로 近 倍額에 達하리만큼 增加되엇으며 納稅者 數도 大正10年엔 295人이든 것이 昭和 4年엔 1304人이란 數字로 6倍나 增加되엇다. 朝鮮에서는 個人 所得에 對한 所得稅가 아니라 法人의 普通所得, 超過所得, 淸算所得에 對한 課稅이나 稅制의 必然的 發達에 依하야 생각건대 朝鮮에서도 所得稅라는 것이 將來 有望하게 될 것이 事實일가 한다. 如斯히 重要性을 가진 稅에 對하야는 朝鮮의 負擔能力이라든지 將來 能力을 考察하고 싶으나 參考資料의 不完全으로 因하야 數字的 分析과 推斷을 하지 못함은 遺憾으로 생각하는 것이다. (다) 營業稅 營業稅는 地稅라든지 所得稅에 比하야 比較的 新稅로서 昭和 2年에 創設된 것으로 同年度엔 9萬7千圓에 達하엿다. 所得稅에 잇어서와 같이 民族別 納入額을 參考할만한 資料가 無하므로 이에 略한다. (라) 資本利子稅 資本利子稅 亦 營業稅와 同年度에 創設된 것으로 昭和 2年度엔 317,579圓이엇는데 同5年度엔 337,705圓에 達하얏다. (마) 鑛稅 鑛稅는 以上 論한 諸稅와 그 「텐덴씨」가 달러 大正7年度에 626,914圓이엇든 것이 昭和5年度에는 544,849圓으로 減少되엇다. 다시 昭和 2年度 505千圓에 比하면 增加된 세음이라 한다. (바) 其他稅 (單位 千圓) 以上 統計 數字에 依하건대 朝鮮銀行券 發行稅, 取引所稅 及 煙草耕作稅는 各各 減少되엇으며 酒稅를 爲始하야 其他는 全部 增加되엇다. 통터러 國稅의 一般的 趨勢를 考察한다면 增加2字로 說明할 <36> 수 잇다는 것이다. (2) 地方稅와 그 趨勢 朝鮮에 現行되는 地方稅 稅目은 地稅附加稅, 所得稅附加稅, 戶稅, 家屋稅, 特別市場稅, 屠畜稅 及 屠場稅, 漁業稅, 船稅, 車輛稅 及 不動産取得稅 等이다. 이에 個別的 趨勢를 考察하건대 이러하다. (單位 千圓) 以上 數字에 依하건대 船稅를 除外로 過去 12年間 그 增加額은 可驚할만큼 되엇다. 過去 7年間 新種目의 稅가 創設되엇으므로 數字的 完全을 期하기 爲하야 昭和2年度의 地方稅額을 同5年度의 그것에 比較한다 하드라도 17,220,145, 對 17,895,468이며, 大正 7年度의 그것에 比하면 近 17倍의 增加이다. 다시 大正11年度의 9,945,203圓을 昭和 3年의 17,388,667圓에 比하면 1.7퍼센트의 增加이다. (3) 府稅와 그 趨勢 國稅이니 地方稅니 하야 以上에 數十 餘 種目을 擧하엿다. 그러면 이 以外에 府稅라는 것은 무엇인가 列擧하면 이러하다. 地稅附加稅, 所得附加稅, 營業稅附加稅, 取引所稅附加稅, 地方稅家屋稅附加稅, 地方稅般稅附加稅, 地方稅車輛稅附加稅, 地方稅特別所得稅附加稅, 戶別稅, 特別戶別稅, 特別營業稅, 雜種稅, 助興稅, 土地增價稅, 埋築免稅地坪數割, 受盖稅. 特別所得稅 等 17種目이라 한다. 이에 그 趨勢를 考察하건대 이러하다. (單位 圓) 以上 擧한 바 府稅의 財政的 趨勢를 考察하건대 耕作地面과 人口가 增加된 證據로 지세계통과 戶稅 及 家屋稅 系統이 增加된 것은 勿論이나 紙面關係로 累年 比較 數字는 表하지 못하엿으나 營業稅系統은 大正11年度부터 昭和 元年度 間의 稅額보다 昭和 2年度부터 同 5年度 間의 稅額은 約 1.2퍼센트나 減少되엇다. 船稅附加稅, 法人所得稅附加稅 及 特別所得稅, 取引所稅附加稅, 助興稅 等은 大正10年度부터 創設된 稅로서 助興稅를 除한 外에는 減少되엇다. 그러나 府稅額 全部로 보아 大正11年度의 2,122,596圓 對 昭和5年度의 2,702,589圓을 比較하건대 1,2퍼센트의 增加일다. (4) 面賦課金과 그 趨勢 面賦課金이란 것은 地稅割, 營業稅割, 特別營業割, 雜種割, 鑛業割, 戶別割, 漁業割 及 段別割 等이라 한다. 이에 그 趨勢를 檢討하건대 이러하다. (單位 千圓) <37> 面賦課金도 以上 數字에 表示되엇음과 같이 一般的으로 增加되엇다. 合計로 본다면 大正 11年度에는 11,587,366圓이엇는데 昭和 5年度에는 13,484,229圓으로서 約 1.2퍼센트의 增加일다. 學校費 賦課金이라는 것은 戶稅 及 家屋稅系統에서 徵收되는 ",동광,1932,논설,金佑枰,"稅金! 稅金!, 朝鮮租稅의 趨勢와 朝鮮人의 負擔"
colonial_magazines_0260,笑話 (소화) 卽効 「좃치안은 놈들을 맛나서 주소가 어듸냐고 물으면 거저 시외라고 대답하는 것이 좃치.」 「아- 그것 참 조흔 대답일세. 그래 자네 지금 어듸서 사는가?」 「시외에 살지.」 顔色 「웨 그럿케 얼골 색이 좃치 못한가?」 「사실인즉 의사가 내 안해를 피서지에 보내라고 하는데 내가 섭섭한 얼골을 해야 안심하고 속히 갈 것이니 하로래도 안해의 얼골을 속히 안보는 방책으로서 이러케 하는 걸세.」 平壤 「나는 平壤에 안 나기를 잘햇네.」 「웨?」 「거기는 아는 사람이 하나 업스닛까.」 新婚旅行 「야- 어듸 가는가?」 「신혼여행일세.」<92> 「신부는?」 「집에서 집 직히고 잇네.」 물에 빠진 남자 「야- 이겻 좀 견저 조- 헴 칠줄 몰나서-」 「좃치 헴치는 연습도 할 겸.」 前後 안해 「여보세요. 잔등이 가려워 죽겟서요. 무에 드러 갓는지 몰나.」 남편 「보기 실혀. 그런 말은 결혼 전 연애시대에 할 말이지.」 순서 「이 사람 미안하지만 급히 쓸 일 잇는데 천원만 취해 주게.」 「응 취해 주지. 여행갓다 와서.」 「오- 언제 간단 말인가.」 「그거야 돈이 생겨야지.」 一理 안해가 뜨거운 물에 어린애를 너을여고 할 제 남편 「안돼. 정신잇나? 45도나 되는 뜨거운 물에.」 안해 「그럿치만 어린애가 뜨거운 줄 아는가?」<93> <92-93>,만국부인,1932,잡저,Unknown,笑話
colonial_magazines_0261,"어머니 죽인 두 姉妹의 그 後 消息 (어머니 죽인 두 자매의 그 후 소식) 咸北 城津港에서 이러난 사건. 딸을 밀고햇다고 어머니를 죽여 버린 두 처녀의 진상은 임이 신문지상에 게재된 바니 길게 쓸 필요 업겟지만 그 두 처녀들은 그 후에 엇더케 되여는고? 참새 방송실에 날여드러온 소식에 의하면 그들은 지금 淸津刑務所에 잇는데 아직 豫審中이라 한다. 그런데 진정한 사건 진상을 알어 보니 신문에 보도된 것과는 좀 달너. 어머니가 딸을 밀고한 것이 안이고 큰딸의 애인인 사회운동자-모씨가 밀고한 것이라고. 아모리 악독한 어머닌들 자기 딸이야 밀고햇을가? 어머니를 움물에 집어 너은 딸들은 애정문제를 떠나서 순전히 嚴正한 계급적 입장에서 판단을 내리워 가지고 한 일인지는 몰으지만, 혹 뒤에 리-더가 잇지나 안는가 하는 세상풍설도 떠든단니 어느 것이 사실인지!? <98> <98>",만국부인,1932,잡저,Unknown,어머니 죽인 두 姉妹의 그 後 消息
colonial_magazines_0262,約婚時代에 愛人에게 준(밧은) 선물 (약혼시대에 애인에게 준(밧은) 선물) 아모 것도 업섯서요 獨鵑 나의 이번 결혼은 시대를 역행하엿다 할가요. 결혼 전의 교제라고 별로 업섯서요. 그러기에 약혼시대에 내가 보낸 선물도 업섯고 또 그이로부터 밧은 「푸레센트」도 업섯슴니다.<9> 내가 밋젓지요 金東仁 평양도 시골인지라 「수」를 놋는 숫실이 여염집에서는 어더보기 어러워요. 그러기에 나는 약혼시대에 벼개나 무엇에나 수 노을 때 쓰라고 숫실을 몃 탈애 사다가 주엇슴니다. 그밧게 내가 보낸 「푸레젠트」라 하면 몃 낫 아니 되지만은 대개 실용품을 사서 주엇서요. 그리고 내가 저편으로부터 밧은 선물을 언젠가 맛낫슬 때 손수건을 주드군요. 약혼긔간 동안에 전후를 통하여 나는 손수건 두 개를 밧엇서요. 말하자면 내가 밋진 셈이지요.<10> 원악 가난햇스닛가요 沈薰 약혼시대에 주고밧은 푸레쎈트요. 그것은 다 잇는 사람들이나 하는 일이지요. 우리는 원악 가난해서 그런 즛을 통 못해 보앗슴니다. 民籍謄本을 맛겻소 黃施德 미국서는 보닛가요 약혼시대에 으레히 따이야 박은 반지를 주고 밧더군요. 그러나 우리는 구식으로 햇스니까 그런 푸레센트갓흔 것은 전연 업섯고 民籍謄本만 서로 주고 밧엇서요.<11> <9-11>,만국부인,1932,설문,Unknown,約婚時代에 愛人에게 준(밧은) 선물
colonial_magazines_0263,"世界女流作家 半生記 오-스트리아篇, 소설 = 『그랜드·호텔』의 著作者 뵈이쓰키바움 女史 (세계녀류작가 반생기 오-스트리아편, 소설 = 『그랜드·호텔』의 저작자 뵈이쓰키바움 녀사) 崔露砂 뷔이쓰키·바움 여사가 세계적으로 일홈을 날니게 되기는 소설 그랜드·호텔을<38> 쓰고 나서 부터여섯다. 그는 오-스타리아 수도 뷘-나에서 탄생하엿다. 그에게 나희가 몃 살인가고 물으면 그는 언제나 이럿케 말한다. 「나는 내 나희를 말하고 십지 안슴니다. 여러분이 너무도 알고 십허 하기 때문에요. 그러나 이것만은 말해 두겟슴니다. 내가 나든 해가 즉 황제 푸란쓰·요셉 폐하가 세상에 강림하시든 해인 것을요! 그 때의 뷔-ᄂ 도시는 지금처럼 쓸쓸한 한숨 만코 눈물 만흔 도시가 안이엿슴니다.」하고만 이약이할 뿐이고 두 번재 입을 떼지 안슴니다. 어린 때- 문예보다 음악을 즐기엿다. 물론 음악에 대한 소질도 잇섯겟지만 그 祖父와 또 어머니가 음악에 대단한 취미를 가지고 잇섯기 때문이라고 한다. 몹시 로맨틱해서 때때로 洋琴줄 우에 손을 날니고 잇다가는 끗업는 공상에 파무처서 흐륵흐륵 늣겨 우는 때도 잇섯다고. 여덜쌀 적부터 벌서 가삼에 끌어으르는 공상을 노래로 시로 읇흘 줄 알엇다. 14, 5歲時의 그는 한 사람 완전한 음악가로서 여기저기에 개최되는 음악회에 출연하게 되엿다. 세월이 가서 그는 벌서 이성을 알게까지 되엿다. 누가 가라처 주지 안어도 자기 선생을 상대로 하야 연문을 몃 장이나 썻단다. 그러나 그 것을 선생안태까지 보낼 만한 용기는 가지지 못햇든 것이다. 뷔이쓰키·바음은 극장에 드러갓섯다만은 그 곳에 오래 머믈지 안코 곳 그만두게 되엿단다. 그런데 여기서 한 마듸 말해둘 것은 뷔이쓰키·바움 여사의 현재 남편은 그 당시에 한 극장에서 일하든 사람이라는 것이다. 그 당시의 현재 남편은 그곳에서 심부럼할 뿐이엿섯다.<39> 그는 또 다시 엇든 가극단에 드러가섯다. 거기서 깁흔 뜻도 업시 엇던 남자와 결혼하게 되엿는데 그 남자는 뽀헤미아인으로 소설을 쓰고 잇섯다. 3년 간 그TM€ 同棲생활 하다가 중도에 서로 떠러지게 되엿섯다. 결혼 생활에서 탈출한 뷔이쓰키는 뷔-ᄂ에 도시를 떠나서 다룸스탓트에 이르러 또 가극단에 드러갓는데 이번에는 악대원으로서 드러가계 되엿다. 그런데 여기서 놀날만한 이약이는 그 악대지휘장이 녯날 3년 전에 뷔-ᄂ 가극단에서 알엇든 청년- 현재 남편이엿다는 것이다. 얼마나 이상한 해후이랴? 그들은 친해서 동무가 되고 연인이 되고 또 부부가 되엿섯다. 때 마츰 구주대전이 니러나는 때임으로 그들은 퍽으나 비참한 생활을 게속하게 되엿다. 그는 곳 劇界를 떠나서 창작에만 전력햇섯다. 거기에 훈련업섯든 그는 모조리 다- 조흔 작품을 쓸 수가 업섯다. 그는 만히 썻다가도 불에 집어넛는 것이 상례엿다. 하로는 불에 사르든 중 2, 3편를 남겨 두엇더니 동모가 읽고 보고 하도 좃타고 가지고 가서 엇던 서점과 출판하기로 약속햇섯다. 그것이 즉 여사의 處女集이엿다. 그를 세계적 여류작가로 만드러 노흔 그랜드 호텔의 재료도 대부분은 그 處女集에서 취해 낸 것이란다. 「그랜드·호텔」은 그가 伯林에서 8개년간 고생하든 경험을 주제로 한 것이다. 그는 부리쓰톨·호텔에 하녀로 잇으면서 호텔에 투숙하는 손님들을 주의하야 관찰해보니 여러 가지로 인생관이 달느게 상상되엿섯다고 엇잿든 3년간 재료를 모아가지고 3주일간 내로 그랜드·호텔을 완성햇섯다. 그것이 곳 脚本이 되여서 무대에 상연하게 되자 세상의 평을 말할 수 업시 좃왓섯다.(끗) <40> <38-40>",만국부인,1932,문예평론,崔露砂 최로사,"世界女流作家 半生記 오-스트리아篇, 소설 = 『그랜드·호텔』의 著作者 뵈이쓰키바움 女史"
