doc_id,text,newspaper,year,summit_episode,title
inter_korean_summit_0236,"미국 국방부는 19일(현지 시각) 문재인 대통령과 김정은 북한 국무위원장의 평양 정상회담에서 남북이 채택한 군사 분야 합의서와 관련해 “한국 측과 긴밀히 논의하겠다“는 입장을 내 놨다. 양측이 19일 채택한 '판문점 선언 이행을 위한 군사 분야 합의서'는 육상과 해상, 공중에서 일체의 적대 행위를 금지하는 것이 핵심 내용이다.? 자유아시아 방송(RFA)에 따르면, 크리스토퍼 로건 미 국방부 대변인은 이날 남북한 군사 분야 합의서에 대한 RFA의 논평 요청에 “합의서 내용은 동맹인 한국과 함께 철저하게 검토하고 논의할 것“이라면서, “우리는 합의 내용 하나하나에 논평을 하거나 이와 관련해서 향후 일어날 일과 관련해 추측하지 않을 것“이라면서 밝혔다.? 한국과 북한은 합의서에 따라 비무장 지대(DMZ) 내 감시 초소(GP)를 전부 철수하기로 하고, 시범적 조치로 상호 1km 이내 근접해 있는 남북 GP를 완전히 철수하기로 했다. 판문점 공동경비구역을 비무장화하고, DMZ 내 남북 공동 유해 발굴 작업과 역사 유적 공동 조사에도 나선다. 또한 서해 해상에 평화 수역을 설정하고, 해상에서의 우발적 충돌을 방지하고 적대 행위를 중지하기로 했다.? 이러한 조치에 대해 회의적인 시각도 적지 않다. 북핵이 그대론 상황에서 한국 군사력만 약화될 것이란 우려도 나오고 있다. 미 국방부 산하 국방정보국(DIA) 출신의 브루스 벡톨 앤젤로 주립대 교수는 남북 군사 분야 합의서와 관련해 “내용이 구체적이지 않아 실제로 이행될지 의문“이라고 주장했다. 벡톨 교수는 “우리는 언제 DMZ에서 감시 초소가 철수될지, 언제 공동경비구역(JSA)이 비무장화될지, 북한이 서울을 조준해 개성/문산 연결 지역에 배치한 수백 개의 포대를 언제 제거할지 모른다“며 “남북 두 정상이 구체적인 내용 없이 희망사항을 군사 합의서에 나열한 것 외에는 없다“고 했다. 그러면서 그는 “그렇기 때문에 이 합의서가 한반도의 평화를 담보할 수 있을지 판단하기 어렵다“고도 했다.? 벡톨 교수는 북한이 최종적으로 이행해야 할 가장 중요한 조치는 핵 프로그램을 폐기하는 것이라고도 강조했다.",Chosun Ilbo,2018,2018_multi_summit,"美 국방부 “남북 군사 합의, 한국과 긴밀히 검토“"
inter_korean_summit_0237,"남북 군 당국은 19일 한반도 내 군사적 긴장을 완화하고 신뢰를 구축하기 위해 '판문점 선언 이행을 위한 군사 분야 합의서'를 체결했다. 지상과 해상, 공중에서의 모든 적대 행위 중단, 한강(임진강) 하구 공동 이용 등이 골자다. 문제는 급격한 군축으로 인한 안보 불안이다. 군 당국자는 “우리도 우리지만 북한의 군축이 더 큰 부분이 있다“고 했지만, 군 안팎에서는 “진전된 부분도 있지만, 북한이 비핵화를 이루기까지 상호 감독할 수 있는 체계를 잘 갖춰야 하는데 서두른 측면이 있다“는 지적이 나왔다.",Chosun Ilbo,2018,2018_multi_summit,"연평도 지키는 자주 포, 연평도서 훈련 못 한다"
inter_korean_summit_0238,"남북은 이번 합의를 통해 지상과 해상, 공중을 비롯한 모든 공간에서 일체의 적대 행위를 전면 중지하기로 했다. 이에 따라 완충 지역을 설정하고 이 지역에서 상대방을 겨냥한 각종 군사 연습을 중지하기로 했다. 우선 지상은 군사 분계선으로부터 5km, 남북 총 10km 이내 지역이 완충 지대로 설정됐다. 완충 수역은 서해의 경우 남측 덕적도 이북으로부터 북측 초도 이남까지, 동해는 남측 속초 이북으로부터 북측 통천 이남까지로 정해졌다. 완충 수역에는 백령도, 연평도 등 서북 도서 지역도 포함됐다. 이와 관련 국방부 당국자는 “해병대 K/9 사격 훈련의 경우 포는 그대로 유지하되 훈련은 (육진) 3 군 사격장에서 하게 될 것“이라고 했다. 군 관계자는 “당장 작전에 필요한 포는 옮기지 않고 두되, 예비용 포를 육지로 옮겨 훈련한다는 뜻으로 풀이된다“고 설명했다. 이번 합의서에는 서해 북방 한계선(NLL)관련 언급은 생략됐다. 이번 정상회담에 앞서 열린 군사 회담에서 남북은 NLL에 대한 입장 차가 컸고 이견을 끝내 좁히지 못한 것으로 알려졌다. 평화 수역 조성과 관련해 우리 측은 NLL를 기준으로 해야 한다는 반면, 북한은 NLL를 인정 못 하겠다는 입장이다. 국방부 당국자는 “NLL는 이번 합의의 대상이 아녔다“며 “완충 수역은 NLL를 뛰어넘는 한 단계 위의 이야기“라고 했다. 잇어 “NLL 문제는 앞으로 협의해 나갈 것“이라고 했다. 공동 어로 구역 설정 등 NLL와 관련된 민감한 사안은 향후 다시 논의하겠다는 말이다.",Chosun Ilbo,2018,2018_multi_summit,완충 지대에서 군사 연습 중지 해병대 K/9 사격 훈련은 육지에서
inter_korean_summit_0239,"공중 완충 구역은 군사 분계선으로부터 서부 20km, 동부 40km 이내의 상공으로 설정됐다. 국방부 당국자는 “서울이 군사 분계선으로부터 약 40km밖에 떨어져 있지 않기 때문에 여기까지 비행 금지 구역으로 설정하면 영공 방위에 문제가 생긴다“고 했다. 일각에서는 완충 구역 내에서 비행을 금지하면 무인기나 정찰기를 이용하는 데 문제가 있을 것이라는 지적도 나왔다. 이와 관련, 국방부 당국자는 “40km 뒤로 정찰기를 뺀다고 하더라도 못 보는 구역이 발생하지 않는다“며 “정찰 능력이 이보다 뛰어나기 때문“이라고 했다. 하지만 한 군 관계자는 “마치 우리가 북한을 다 볼 수 있는 것처럼 얘기해선 안 된다“며 “미국 자산에 의존해 정찰하는 경우가 많은데 공중 완충 구역 설정이 미국과 협의된 부분인지도 의문“이라고 했다.?",Chosun Ilbo,2018,2018_multi_summit,"수도권 방위 괜찮나 공중 완충 구역에선 무인기, 정찰기 못 다녀"
inter_korean_summit_0240,"이번 합의서는 한강(임진강) 하구 공동 이용과 관련한 내용도 담겼다. 현장 조사는 오는 12월 말까지 공동 진행하기로 했다. 하지만 한강 하구를 공동 이용하기로 하면 NLL를 그대로 유지할 수 있을지 논란이 예상된다. 군 당국은 “한강 하구는 남북 민간 선박의 자유롭ㄴ 항행이 보장되는 수역이지만 남북 간 군사적 긴장 상태 지속으로 자유롭게 접근하지 못하았다“며 “특히 골재 채취, 관광, 휴양, 생태 보전 등 다목적 사업을 병행할 수 있다. 앞으로 남북 간 공동 수로 조사 및 민간 선박의 한강 하구 수역 이용을 군사적으로 보장해 나갈 것“이라고 밝혔다. 한편 남북은 내년 4~10월 철원 화살머리 고지 일대에서 DMZ 공동 유해 발굴을 진행하기로 했다. 국방부 당국자는 “우리 쪽만 유해 300여 구가 나올 것으로 예상되며 미군, 프랑스군, 중공군, 북한 군 등 글로벌하게 나올 것 같다“고 했다. 남북은 이와 같은 합의 내용을 남북 군사 공동위를 가동해 추진해 나가기로 했다. 국방부 당국자는 “누가 위원장이 될지는 아직 모른다“면서도 “1992년 우리 측 위원장은 대장 급이, 북측에선 인민 무력부 4성이 위원장을 맡기로 논의한 바 있다“며 “아직 안 가 본 길이지만 양국 정상이 공동 선언을 했으니 이번엔 이루어질 것“이라고 했다.",Chosun Ilbo,2018,2018_multi_summit,"한강 하구 공동 이용, NLL 유지 논란 예상"
inter_korean_summit_0241,"이낙연 국무총리는 20일 “오늘은 남북 정상이 함께 민족의 영산 백두산을 오른다. 이것 또한 역사상 최초의 일“이라며 “회담은 물론, 함께하시는 모든 일정이 조국 분단 이후 모든 역사를 바꾸고 있다“고 말했다. 이 총리는 이날 오전 정부 서울 청사에서 주재한 국정 현안 점검 조정 회의에서 “어제 남북 정상은 평양 공동 선언을 발표했고, 문재인 대통령은 북한 주민 15 만 명 앞에서 옥외 연설을 했다. 분단 사상 최초의 일“이라며 이 같이 밝혔다. 이 총리는 “지난 두 차례의 정상회담이 그랬던 것처럼 이번에도 현실이 상상을 앞섰다“며 “이제 우리의 상상을 넓힐 때가 됐다. 현실은 현실대로 냉철하게 직시하되, 미래의 많은 가능성에 마음의 문을 열고 준비해 가야겠다“고 했다. 그는 “우리 사회의 일각에는 모든 것을 비판 또는 비관만 하는 사람들도 있다“며 “헬렌 켈러가 말했듯이 비관론자는 별의 비밀을 발견하지도, 미지의 섬으로 항해하지도, 인간 정신의 새롭ㄴ 낙원을 열지도 못한다“고 덧붙였다. 이 총리는 메르스(MERS 중동 호흡기 증후군)와 관련, “내일 밤 12시가 되면 메르스 상황에서 사실상 벗어나게 된다“며 “추석 연휴가 시작되기 전에 메르스 불안에서 벗어나게 돼 참으로 다행“이라고 말했다. 그는 “그동안 수고하신 질병 관리 본부 등 관계 부처 직원 여러분과 협조해 주신 국민 여러분께 감사 드린다“며 “추석 연휴 기간에도 혹시 모를 모든 일에 물 샐 틈 없이 대처해 달라“고 당부했다. 한국당 “비핵화 진전 없고 국방력만 약화시키는 합의“김병준 자유한국당 비상 대책 위원장은 20일 “어제 발표된 남북정상회담 합의를 보면, 비핵화 문제는 거의 진전이 없고 한국의 국방력은 상당히 약화시켜 버렸다“고 밝혔다. 김 비대 위원장은 이날 오전 국회에서 열린 비상 대책 회의에 참석해 “전쟁은 한 사람이나 잘 짜인 계획뿐 아니라 우연 발생적인 사고에 의해서도 일어날 수 있는데, 그에 대한 대비가 약화돼 걱정이 많다“며 이 같이 말했다. 김 위원장은 “문재인 대통령은 북한 인민군의 사열을 받고 감격스러웠을 것“이라며 “(그러나 문 대통령이) 국민 안전과 민족사적 큰 결정이라도 혹시 내가 잘못 결정한 것은 아닌지 스스로 의심하길 바란다“고 했다. 김성태 원내 대표 역시 “북한은 역시 협상을 잘한다“며 “서해선 철도 도로 연결, 개성 공단 금강산 관광 사업 정상화, 서해 경제 특구 동해 관광 특구 조성, 2032년 하계 올림픽 공동 개최 등 단물은 다 챙겼지만, 미국과 국제 사회가 끊임없이 요구해 온 비핵화 실질 조치에 대해선 아무것도 받아들인 것이 없다“고 밝혔다. 김 원내 대표는 “핵 물질 핵탄두 핵 시설 리스트 신고는 북한이 고수하고 있는 단계적 비핵화 방안을 문 대통령이 오히려 명시적으로 용인해 준 꼴“이라며 “비핵화 협상을 하겠다면서 비핵화 로드맵도, 선언도 아무것도 없이 북한 입장을 받아들이는 회담이 되고 말았다는 것에 유감“이라고 말했다. 그는 “군사 분야 합의서에 대해서도 사실상 일방적 무장 해제를 강제하고 있어 다시 한 번 깊이 우려한다“며 “특히 군사 분계선 상공에 비행 금지 구역을 설정하고 정찰 자산의 임무를 봉쇄하는 것은, 북한이 여전히 핵무기를 손에 쥐고 있는 마당에 우리만 눈을 감으라는 것“이라고 했다. 잇어 “접경 지역의 군사적 적대 행위 금지와 전략 자산의 봉쇄는 분명히 그 의미가 다르다“며 “한국당은 국방위 긴급 현안 질의를 통해 군사 분야 합의에 대해 명확히 정부의 진의를 묻겠다“고 했다. 김 원내 대표는 또 지난 19일 인사 청문회를 치른 유은혜 교육부 장관 겸 사회 부총리 후보자에 대해 “다시 한 번 유 후보자 스스로 거취를 결정해 주길 바란다“며 자진 사퇴를 압박했다. 그는 “양파 껍질 같은 허물도 허물이지만, 유 후보자 스스로 대한민국의 미래 교육을 감당할 수 있는지 다시 한 번 되새기길 바란다“며 “이런 후보자를 지명한 문 대통령도 문제지만, 문 대통령에게 누가 되지 않기 위해 스스로 거취를 결정해 주길 바란다“고 했다.",Chosun Ilbo,2018,2018_multi_summit,"이낙연 “남북 정상 함께하는 모든 일정, 분단 후 역사 바꿔“"
inter_korean_summit_0242,"윤영찬 청와대 국민 소통 수석은 20일 “(남북 불가침 원칙의) 제도화 문제는 앞으로 여러 사회 각 분야 정치권, 특히 야당과 긴밀히 협의하면서 제도화의 방향에 대해 고민을 같이하겠다“고 말했다. 윤 수석은 이날 3차 남북정상회담 메인 프레스 센턴 서울 동대문디자인플라자(DDP)에서 브리핑을 갖고 “(문 대통령이 사전에 언급한) 불가역적인 단계로 가기 위한, 돌이킬 수 없는 상태로 가기 위한 구체적이고 현실적인 발을 떼고 있다“면서 이 같이 말했다. 윤 수석은 또 '북한의 현재 핵은 그대로 있는데 우리만 무장 해제하는 것이 아니냐'는 비판이 나온다는 질문에 “재래식 무기에 대한 군축은 비핵화를 위해서도 바람직한 방향“이라며 “비핵화는 비핵화대로 해결해 나갈 것이고, 재래식 군축의 문제는 군축대로 남북 간의 관계에서 논의해서 진행해 나갈 것“이라고 했다. 윤 수석은 잇어 “평양 공동 선언에 대해서 오늘 미국 정부에서 트럼프 대통령, 폼페이오 장관이 상당히 긍정적으로 평가했다“며 “한미 정상 간의 대화를 통해서 이 문제에 대해 매우 생산적이고 구체적인 논의들을 진행해 나갈 예정“이라고 했다. 그러면서 “이번 공동 선언에서 만들어 내는 모멘텀을 최대한 살리고, 이를 통해서 북미 간의 대화가 진지하게 이루어지도록 하겠다. 잠시 느슨해졌던 북미 간의 대화의 끈을 복원시키는 방향으로 끌고 가겠다“고 덧붙였다. '북핵과 관련한 현재 핵을 말하는 미국과 미래 핵을 말하는 북한의 괴리가 있다'는 지적에 대해선 “현재 핵과 미래 핵과의 괴리, 그런 괴리가 있기 때문에 해결하기 위한 노력이 진행되고 있고 접점도 반드시 찾아질 것“이라고 했다. 윤 수석은 이와 함께 '김 위원장의 서울 방문 시 한라산 등반 계획'을 묻는 말에 “좋은 아이디어“이라면서 “아직 시간이 있고 준비해야 할 여러 가지 기간이 필요하다. 저희가 참고하겠다“고 했다. '문 대통령이 귀환 후 서울 프레스 센터에서 기자 회견을 할 계획이 있느냐'는 질문엔 “현재 북측과 연락이 안 되고 있다“면서 “(프레스 센터 방문을) 아직 확신할 수 없다. 가능성도 있지만 그렇지 않을 수도 있다“고 답했다. 다음은 윤 수석의 브리핑 일문일답 전문. /오늘 8시 10분에 백화원에서 공항 가는 영상과 평양 영상이 나왔다. 가슴 뭉클했다. 수석께서 정상회담 생방송을 적극 추진하신 것으로 알ㄴ다. 전 세계 언론에 감정 의도에 잘 전달하셨는지. 앞으로도 생중계 방침이신지. “사실 생중계가 이번이 처음이 아니다. 각별하게 신경을 썼던 것ㄴ 현재 벌어지고 있는 한반도의 격한 변화를 전 세계 국민들과 함께 같이 나눠야 한다 생각했다. 지난번 판문점 정상회담에서 확인했듯이 한반도 문제는 동북아 더 나아가서는 전 세계 안보와 직결되는 현안이다. 많은 내외신 기자 분들이 집결한 이유도 그것이다. 그렇기 때문에 한반도 문제를 온 세계에 관심 있는 국민들과 함께 관찰하고 바라보고 함께한다는 것 자체가 한반도 문제를 해결하는 데 매우 중요한 영향을 미칠 것이라고 생각하기 때문에 생중계를 강하게 요청했다. 앞으로 이어질 정상회담에서도 생중계는 있을 것이다.“ /오늘 대통령 귀환 예정 시각과 귀환 이후에 프레스 센터에서 기자 회견할 예정이 있나? “지금 현재 북측과 연락이 안 되고 있습니다만 새벽 들은 바로는 늦은 오후에 삼지연에서 점심을 드시고 비행기를 타고 바로 성남공항으로 출발을 하는 것으로 알고 있다. 현지 상황에 따라서 출발 시간은 조정이 될 수 있다. 현재 대통령께서 프레스 센터를 방문하실 것이냐는 아직 확신할 수 없다. 가능성도 있지만 그렇지 않을 수도 있다. 현지 성남공항에 도착하는 대로 통화하고 상황을 알리겠다.“ /문 대통령과 김 위원장이 백두산을 같이 방문했다. 김 위원장이 서울 방문할 때 같이 한라산으로 갈 수 있는지? “좋은 아이디어다. 아직 시간이 있고 준비해야 할 여러 가지 기간이 필요하기 때문에, 매우 좋은 제안으로, 아이디어로 저희가 참고하겠다.“ /어제 평양 공동 선언에 포함된 군사 분야 합의가 야당 일각에서는 북한의 현재 핵은 그대로 있는데 우리만 무장 해제하는 것이 아니냐는 지적이 나온다. 앞서 트럼프 대통령과 폼페이오 국무 장관, 주변국의 반응을 소개했다. 현재 정상회담 중엔 미국 측과 '실시간 협의 어렵다'고 했는데 비핵화 여정 시작된 것은 대북 특사단이 만나고 미 측과 통화하고 우리 중재 안이 받아들여진 것인가? “군사 분야 관련해서 비핵화 문제는 남북 북미 한미 간의 현재 진행을 통해서, 협의를 통해서 한 축으로 프로세스가 진행되고 있는 것ㄹ 여러분이 보고 계신다. 비핵화와 재래식 무기를 저희가 같이 미국과 삼각 관계에서 논의를 해야할 문제다. 재래식 무기에 대한 군축은 비핵화를 위해서도 바람직한 방향이다. 비핵화는 비핵화대로 해결해 나갈 것이고, 재래식 군축의 문제는 군축대로 남북 간의 관계에서 논의해서 진행해 나갈 것이다.“ /어제 두 정상이 합의한 공동 선언이 대통령께서 방북하시기 전 말씀하셨던 돌이킬 수 없는 진전 나가는 것이 중요하다 하셨는데, 그 진도에 도달했다고 생각하나. 두 정상의 불가침 의지는 확인됐는데 이것의 제도화 정상적 진행 추진 이것은 남한 내 국내 상황을 추후 상황들이 진행돼야 할 것 같은데 계획은? “아직 이런 부분들에 단정적으로 말씀 드리긴 어렵ㄴ 시점이다. 불가역적인 단계로 가기 위한, 돌이킬 수 없는 상태로 가기 위한 구체적이고 현실적인 발을 떼고 있다. 그리고 이와 관련된 우리 남쪽의 제도화 문제는 앞으로 여러 사회 각 분야, 정치권, 특히 야당과 긴밀히 협의하면서 제도화의 방향에 대한 고민들을 같이 하겠다.“ /북한과 대화를 이어 가는 것과 관련해서 미국의 입장에 관련한 한국 정부의 코멘트 궁금하다.",Chosun Ilbo,2018,2018_multi_summit,"윤영찬 “남북 불가침 제도화, 야당과 긴밀히 협의“"
inter_korean_summit_0243,"“북한과 어제 같이했던 평양 공동 선언에 대해서 오늘 미국 정부에서 트럼프 대통령, 폼페이오 장관이 상당히 긍정적으로 평가했다. 저희는 앞으로 이어지는 한미 정상 간의 대화를 통해서 이 문제에 대해 매우 생산적이고 구체적인 논의들을 진행해 나갈 예정이다. 이것ㄹ 바탕으로 이번 공동 선언에서 만들어 내는 모멘텀을 최대한 살리고, 이를 통해서 북미 간의 대화가 진지하게 이루어지도록 하겠다. 잠시 느슨해졌던 북미 간의 대화의 끈을 복원시키는 방향으로 끌고 가겠다.“ /김 위원장의 서울 답방을 문재인 대통령이 제안했는데 미국과 협의가 돼 있었는지, 종전 선언을 할 가능성이 있는지. 문정인 특별 보좌관께서 하신 말씀이 미국과 한국의 핵 문제에서 북한은 미래 핵, 미국은 현재 핵을 말한다. 동창리 폐쇄는 그 괴리를 해결하는것이 아니란 주장 있다. “서울 답방 부문 대한 미국과 협의 문제는 제가 확인해 드릴 만한 정보가 없다. 남북 간 관계에 있어 상황에 대해선 미국과 긴밀히 협의하고 있다는 것으로 말씀 드릴 수 있다. 문정인 특보가 말씀하신 현재 핵과 미래 핵과의 괴리, 그런 괴리가 있기 때문에 해결하기 위한 노력들이 진행되고 있고 접점도 반드시 찾아질 것이다.“ 유엔 사무총장 “남북회담 결과 환영 이젠 구체적 행동 보일 때“안토니우 구테흐스<사진>?유엔 사무총장은 19일(현지 시각) 문재인 대통령과 김정은 북한 국무위원장의 평양 남북 정상회담 결과를 “환영한다“면서도 “이제는 구체적인 행동을 보여 줄 때“이라는 입장을 밝혔다. 1 2차 남북 정상회담과 미북 정상회담에 잇어 남북 정상이 세 번째로 만나 북한 비핵화를 다시 합의한 만큼 북한이 실질적인 비핵화 조치에 나서야 한다는 의미로 풀이된다.? 구테흐스 사무총장은 이날 성명을 통해 “유엔은 한국과 북한이 적절하다고 생각하는 어떤 방식으로든 더 지원할 준비가 돼 있다“며 이렇게 밝혔다.? 구테흐스 사무총장은 “중요한 합의를 이끌어 낸 두 정상의 결단력과 외교를 칭찬한다“며 “공동 성명에 반영된 합의 사항들은 중요한 군사적 신뢰 관계 구축을 위한 조치와 관련국 전문가들의 참관하에 미사일 엔진 시험장을 해체하겠다는 북한의 약속을 아우르고 있다“고 했다.? 그러면서 그는 “국제 사회는 유엔 안전보장이사회 결의에 따른 지속적인 평화와 안전, 완전하고 검증 가능한 한반도의 비핵화를 위한 한국과 북한의 노력을 지지해야 한다“고 촉구했다.? 구테흐스 사무총장은 지난달 8일 일본을 방문해 아베 신조 일본 총리를 만난 자리에서 “북한이 '완전하고 검증 가능하며 되돌릴 수 없는 비핵화(CVID)'를 통해 국제 사회의 정상적 일원이 될 수 있다“고 말해 북한으로부터 맹비난을 받았다.? 당시 북한 관영 조선중앙통신은 '망발' '무지 몽매한 소리' 등의 표현을 쓰며 구테흐스 총장을 비난했다. 북한 유엔 대표부도 성명을 통해 “유엔 사무총장은 특정 국가의 비위를 맞추기 위해 제재에 장단을 맞출 것이 아니라 한반도의 평화와 안정을 위해 현 상황에 도움이 되는 일을 해야 한다“고 했다. 여기서 '특정 국가'는 북한이 실질적인 비핵화 조치를 취하기 전까지 대북 제재를 유지해야 한다고 주장하는 미국을 뜻한다. 유엔 총회 기간인 오는 27일 마이크 폼페이오 미 국무 장관은 북핵 문제 등을 다룰 유엔 안전보장이사회 회의를 주재할 예정이다. 미 국무부는 폼페이오 장관이 회의에서 북한의 '최종적이고 완전하게 검증된 비핵화'를 위해 미국이 취해 온 조치들을 소개할 것이라고 밝혔다.",Chosun Ilbo,2018,2018_multi_summit,북한의 상응 조치에 대한 입장도 어떤 입장이신지
