doc_id,text,newspaper,year,summit_episode,title
inter_korean_summit_0352,"더불어민주당이 지난 26일 열린 제2차 남북정상회담에 대해 “한반도 평화를 향한 의지와 신뢰를 재확인한 파격적인 정상회담“이라고 평가했다. 백혜련 더불어민주당 대변인은 27일 논평을 통해 “어제 회담에서 한반도 비핵화에 대한 남북미 정상의 의지, 북미정상회담을 바라는 김정은 북한 국무위원장의 뜻을 명확히 확인한 만큼 한반도 평화와 번영을 위한 본격적인 탄력이 붙었다“고 밝혔다. 또 “북미정상회담의 추진 과정에서 야기된 오해와 갈등 등으로 '시계 제로'인 상황에 직면했지만, 문재인 대통령의 중재 노력으로 꺼져 가던 평화의 불씨를 되살릴 수 있었다“고 말했다. 야당을 향해서는 '초당적 협력'을 강조했다. 백 대변인은 “안보에는 여야가 없다는 말은 단순한 수사가 아니다“이라며, “한반도 평화를 위한 문재인 정부 행보에 야당의 협력을 당부한다“고 했다. 같은 당의 박경미 원내 대변인 역시 논평을 통해 “하루 24시간, 몸이 열 개라도 부족한 문 대통령의 눈물겹ㄴ 노력에 국회가 할 수 있는 것은 오는 28일 역사적인 '4.27 판문점 선언 지지 결의 안'을 통과시키는 일“이라고 밝혔다. 박 원내 대변인은 “야당의 초당적 협력이 그 어느 때보다 절실하다“며 “한반도 비핵화와 평화 체제 구축의 국민적 염원을 담은 '4.27 판문점 선언 지지 결의 안'의 본회의 통과는 국민에 대한 국회의 의무라는 점을 다시 한 번 강조한다“고 말했다. 앞서 여야는 28일 본회의를 열고 4.27 남북정상회담 합의문인 판문점 선언 지지 결의 안을 처리하기로 합의했다. 그러나 자유한국당은 북/미 정상회담 취소를 거론하며, 지지 결의 안 처리 재검토를 내비친 바 있다. 바른미래당 “북 핵 폐기 의지 확인 환영“남북정상회담 관련 논평 바른미래당은 27일 전날 열린 남북정상회담과 관련해 “환영한다“고 긍정적으로 평가했다. 신용현 수석 대변인은 이날 논평을 내 “북한의 핵 폐기 의지 확인을 환영하고 문제 해결을 위한 격식 없는 남북정상회담 개최를 평가한다“고 밝혔다. 잇어 “김정은 위원장이 격식 없는 판문점 남북정상회담을 요청해 남북정상회담을 갖고, 이 자리에서 비핵화 의지를 분명히 하고 북미정상회담을 통해 한반도의 평화 구축을 하겠다는 의지를 밝힌 것을 환영한다“고 밝혔다. 아울러 “이번 남북정상회담이 필요에 따라 언제든지 격식 없이 열릴 수 있다는 사례를 만들ㄴ 것으로 큰 의미가 있다“고 평가했다. 끝으로 신 수석 대변인은 “6.12 북미 정상회담이 성공적으로 개최돼 한반도 비핵화가 실질적인 결실을 거둘 수 있기를 바라며, 이를 위해 확고한 한미 동맹과 단기간 내 완전한 핵 폐기 원칙이 고수돼야 할 것이다“이라며 “핵 폐기 실현을 통해 남북 평화 협력이 진전되기를 기대한다“고 밝혔다. [영상] 청와대, 2차 남북정상회담 머리 마무리 발언 영상 공개 김정은 “제대로 잘 (대접)못하아 미안합니다“문재인 “이렇게 쉽게 만날 수 있다는 것이“문재인 대통령과 김정은 북한 국무위원장은 지난 26일 판문점 북쪽 지역 통일각에서 열린 두 번째 남북 정상회담에서 상대에 예우를 갖춘 인사로 회담을 시작했다. 김 위원장은 비공개 회담인 탓에 성대한 환영 행사 등을 준비하지 못한 점이 마음에 걸리는 듯, “비공개 회담을 하니까 제대로 잘 못 해서 미안한 마음입니다. 평양에 한 번 오시면“이라고 양해를 구했다. 그러자 문 대통령은 “평양을 방문해서 제대로 대접 받는 것도 의미 있지만, 남북 정상이 이렇게 쉽게 판문점에서 만날 수 있다는 것도 남북 간 새롭ㄴ 시대라고 생각한다“고 답했다. 김 위원장은 4.27 남북 정상회담 이후 29일 만에 두 정상이 다시 만난 데 대해 “마음이 더 가까워지는 과정이라고 생각한다“고 말했다. 다음은 청와대가 27일 공개한 남북 정상들의 머리 발언과 마무리 발언 영상을 토대로 정리한 것이다. 영상의 음질 상태가 좋지 않아, 발언이 잘 들리지 않는 부분도 있다. <남북정상회담 머리 발언> 김정은 북한 국무위원장 4차 북남 회담 책임지고 이행해 나가는 문제를... 많은 분들이 기대를 가지고 보셨고, (남북)화합에 국제 사회가 환영 박수 보냈는데 우리가 넘어 가지 못하면.. 얼마든지 자주 만나서 얘기하고, 같이 얘기 나누면서 풀어 나가면 그때 한 약속을 이행할 수 있는.. (그리고 문 대통령이) 북쪽 찾아온 것이 처음이 아니다. 4.27 때도 명장면 중 하나가 10초 동안 깜짝 넘어 온 것 아니냐. (웃음) 장소도 그렇고, 사전에 비공개 회담을 하니까 제대로 잘 못 해서 미안한 마음입니다.",Hankyoreh,2018,2018_multi_summit,민주 “국회 '판문점 선언 지지 결의 안'으로 화답해야“제2차 남북정상회담 환영 논평 28일 본회의서 결의 안 통과 강조
inter_korean_summit_0353,"문재인 대통령 평양을 방문해서 제대로 대접 받는 것도 의미 있지만, 남북 정상이 이렇게 쉽게 판문점에서 만날 수 있다는 것도 남북 간 새롭ㄴ 시대라고 생각한다. 지난번 4.27 판문점 선언 이후에 아마 남쪽에 언론 보도 많이 봤겠지만, 분위기도 좋고 세계 이목도 그렇고 남국 관계에 대해 한껏 (기대가) 높아졌다. 게다가 북미정상회담이 개최되기 때문에 이것을 통해서 평화 체제 구축될 것이라는 그런 기대가 아주 높아졌다. 우리 김정은 위원장은 한국에서도 인기가 높아져서 (웃음) 요즘 남쪽 젊은 사람들은 그동안 남북 관계가 좋지 않아서 (잘 안 들림) 남북 관계 잘 개선해서... 벌써 한 달 됐다.",Hankyoreh,2018,2018_multi_summit,평양에 한 번 오시면... (잘 안 들림)
inter_korean_summit_0354,"김정은 위원장 중요한 것이 북남 문제 허심탄회 대화하는 것이 많은 사람들한테 큰 기대와 희망을 줄 수 있다. 많은 사람들 기대에 부응하고 책임 있게 해야 된다고 생각한다. 문재인 대통령 지난번 4.27 회담 이후에 남북 간 대화에서도 약간의 어렵ㄴ 과정이 있었고 또 조미(북미)정상회담이라든가 아주 중요한 회담을, 그런 문제들에 대해 함께 협력해 나간다는 그런 의지를 다시 한 번 보여 준다는 차원에서 이번 회담이 아주 뜻 깊었다고 생각한다. 뿐만 아니라 과거에는 남북 정상들이 마주 앉으려면 아주 길ㄴ 시간 동안 많은 노력이 필요했는데 필요할 때 이렇게 연락해서 쉽게 만날 수 있다는 것이 남북 관계의 새롭ㄴ 시대를 보여 주는 하나의 징표라고 생각한다. 앞으로 김 위원장과 둘 사이에 함께 남북의 평화 번영 이끌어 나가기를 바란다. 그러기 위해서라도 우리가 조미(북미) 정상회담 반드시 성공하기를 기원한다.",Hankyoreh,2018,2018_multi_summit,그때 4.27 역사적 상봉 맞으면서 많은 사람들이..(영상 끊김)
inter_korean_summit_0355,문 대통령 생각에 공감“정의당은 26일 전격적으로 열린 두 번째 남북정상회담으로 “며칠 간 급격하게 출렁인 한반도 정세가 정상화됐다“고 평가했다. 추혜선 당 수석 대변인은 27일 논평을 통해 “북/미 양 정상의 확고한 의지를 확인했다는 점에서 어제 정상회담은 큰 의미를 갖는다“며 “아울러 어제 정상회담은 한반도 평화 체제 문제는 남북미 3자가 확고한 당사자로서 문제 해결을 주도한다는 것을 보여 주기도 했다“고 밝혔다. 추 수석 대변인은 “비 온 뒤에 땅이 더 굳어지듯 이번의 긴장 국면은 북/미 정상회담의 대성공을 위해 거쳐야 했을 산통이 되길 바란다“고 덧붙였다. 또 '남북은 친구 간의 평범한 일상처럼 이렇게 만나야 한다'는 문 대통령의 생각에도 공감을 표시했다. 추 수석 대변인은 “판문점 회담에서 김정은 위원장이 ‘멀다고 하면 안 되겠구나'라고 말한 것처럼 마음만 먹으면 남북이 손쉽게 만날 수 있는 모습이 일상화돼야 한다“며 “그런 점에서 어제 정상회담은 남북의 물리적 거리뿐만 아니라 마음의 거리도 멀지 않다는 것을 전세계에 보여 준 상징적 장면“이라고 평가했다.,Hankyoreh,2018,2018_multi_summit,정의당 “비 온 뒤에 땅 굳어져 한반도 정세 정상화“남북 2차 정상회담 결과 논평 “'이렇게 만나야 한다'
inter_korean_summit_0356,"문재인 대통령은 27일 “6.12 북/미 정상회담의 실무 협상이 곧 시작되고, 여기에서 (회담) 의제도 논의될 것“이라며 “이것이 얼마나 순탄하게 마치는 지에 따라 6.12 회담이 차질 빚을 것인가 성공할 것인가 달려 있다“고 말했다. 문 대통령은 또 “저는 북미 양국 간에 상대가 무엇을 원하는 지라는 것을 분명히 인식하는 가운데 회담이 추진돼서, 실무 협상과 본회담도 잘 되리라 기대한다“고 밝혔다. 문 대통령은 “김정은 국무위원장의 비핵화 의지는 확고하고, 미국도 북의 그런 의지를 확인한 것 아니냐고 말하고 싶다“며 “미흡하다면 실무 협상서 분명히 확인하리라 본다“고 덧붙였다. 아래는 문 대통령의 기자 회견 일문일답 내용이다.",Hankyoreh,2018,2018_multi_summit,[일문일답] 문 대통령 “북/미 곧 실무 회담 6.12 회담 잘될 것“2차 남북 정상회담 결과 발표 “김정은 위원장 비핵화 의지 확고 미국도 북 의지 확인한 것이라 생각“
inter_korean_summit_0357,"아시는 바와 같이 4.27 선언의 후속 이행과 6.12 북미 회담을 앞둔 준비 과정에서 약간의 어렵ㄴ 사정들이 있었다. 그런 사정들을 잘 불식시키고 북/미 정상회담 성공 일궈 내기 위해, 또 4.27 판문점 선언의 신속한 이행을 함께 해 나가는 것이 매우 중요한 시점이라고 봤다. 그런 상호 이해 아래에서 김정은 위원장이 요청을 해 왔고, 또 남북 실무진이 통화를 통해서 협의하는 것보다 직접 만나서 허심탄회하게 대화 나누는 것이 좋겠다고 판단해 전격 회담이 이루어졌다. 그런 사정 때문에 사전에 회담 사실을 우리 언론에 알리지 못한 데 양해 부탁 드린다. /김정은 위원장이 오늘 북/미 회담이 성공적으로 이루어져야 한다, 한반도의 완전한 비핵화 의지를 피력했다고 했는데, 이런 회담이 실질적인 6.12 회담에 영향 끼칠지 전망은 무엇인가? 또 그 과정에서 남아 있는 변수는? 김정은 위원장은 한반도의 완전한 비핵화의 의지가 확고하다는 것을 어제 다시 한 번 분명하게 피력을 했다. 김정은 위원장에게 불분명한 것은 비핵화의 의지가 아니라, 자신들이 비핵화할 경우, 미국에서 적대 관계를 종식하고 체제 안전을 보장하겠다는 것에 대해서 확실히 신뢰할 수 있는가라는 것에 대한 걱정이 있다고 한다. 반면에 한미 정상회담에서 트럼프 대통령은 북한이 비핵화 할 경우 적대 관계 확실히 해소할 뿐 아니라 경제적 번영까지도 할 수 있다는 점을 피력했다. 저는 양국 간에 각자가 갖고 있는 이런 의제들을 전달하고 또 직접 소통 통해 상대의 의지를 확인할 것을 촉구하고 있는 것이다. 6.12 회담이 성공적으로 열릴 것인지 여부는 지금 북/미 간에 그 준비를 위한 실무 협상이 곧 시작될 것으로 알고 있다. 그 실무 협상 초기에는 의제에 관한 협상도 포함된다. 이 의제에 관한 실무 협상이 얼마나 순탄하게 마쳐지느냐에 따라 (6.12 북/미 회담이) 차질 없이 열릴 것인가 성공할 것인가가 달려 있다고 생각한다. 그러나 저는 북/미 양국 간에 상대가 무엇을 원하고 있는지 분명히 인식하는 가운데 회담이 추진되고 있어서 실무 회담도, 6.12 본회담도 잘 되리라 기대하고 있다. /대통령이 김정은 위원장이 비핵화 의지 확고하다고 말했는데 그 판단의 근거가 무엇인가. 어제 회담에서 김정은 위원장이 뭐라고 밝혔는지 소개 부탁 드린다.",Hankyoreh,2018,2018_multi_summit,"/4.27 남북정상회담 이후 한 달 만에 전격적으로 다시 회담을 했는데 이 정상회담이 이루어진 구체적 배경, 또 비핵화 협상 국면에서 어제 회담이 어떤 의미 갖는지 설명해 달라"
inter_korean_summit_0358,"그 점에 대해서는 제가 여러 차례 이미 말씀 드렸고 폼페이오 국무 장관도 방북 시 김정은 위원장을 만나 직접 확인했다고 말한 바 있다. 그에 대한 추가적인 설명 필요하다고 생각하지 않는다. 실제로 비핵화에 대해서 뜻이 같다 하더라도 그를 어떻게 실현해 나갈 것인가에 대한 로드맵은 또 양국 간에 협의가 필요하고 그런 과정이 어렵ㄹ 수 있다. 그러나 그 로드맵은 북미 간에 협의할 내용이라 제가 앞질러서 제 생각 말씀 드리는 것은 적절하지 않다. /물론 여러 차례 비핵화에 대해 설명했다고 하는데 그 CVID(완전하고 검증 가능하며 불가역적인 핵 폐기)를 북한이 수용하는지는 확인된 바가 없다. 대통령 생각하기에는 CVID가 맞나. 또 어떤 시점에 트럼프 대통령이 어제 만남에 영향을 끼쳤는가. 그 사이 한 번이라도 트럼프 대통령과 직간접 소통했나. 3자 대화는 못하는지? 우선 북한의 비핵화 의지에 대해선 거듭 말씀 드렸기 때문에 제 거듭된 답변이 필요한 것이 아니라 북/미 간에 회담하려면 그 점에 대한 상대의 의지를 확인한 후에 회담이 가능할 것이다. 북/미 간에 회담 합의하고 실무 회담한다는 것은 미국에서도 북한의 그런 의지를 확인한 것 아니냐 말씀 드리고 싶고, 혹시나 확인 작업이 미진한 것이 있다면 실무 회담에서 명확하게 확인될 것이다. 지금 제가 하고 있는 모든 노력은 한편으로 남북 관계 개선시키기 위한 것이 곧 하지만 또 다른 한편으로 남북 관계 개선에 반드시 필요한 북미의 성공을 위한 것이다. 그 북/미 회담의 성공을 위해서 저는 미국, 북한 양국과 긴밀히 소통하고 협의하고 있다. 아시는 바와 같이 최근에 미국을 방문해서 트럼프 대통령과 회담했고, 어제 김정은 위원장과 회담을 가졌다. 어제 김정은 위원장과의 회담에서 논의된 내용은 아시는 바와 같이 이미 미국 측에 전달했다. (3자 핫라인 통화는?) 핫라인 통화라는 것이 말하자면 즉각 전화 받을 수 있는 그런 통신 선이 구축이 돼야한다. 아시는 바와 같이 남북 간에 최근에 그것이 개설됐고, 북/미 간에도 그런 앞으로 구축될 필요가 있다고 본다. 아마도 그런 남/북/미 3국 간의 핫라인 통화를 개설할 정도까지 가려면 사전에 남북미 간에 정상회담부터 먼저 할 수 있지 않을까 생각한다. 저는 그런 기대를 하고 있다. 북/미 회담이 성공할 경우 남/북/미 3자 회담을 통해 종전 선언이 추진됐으며 좋겠다는 기대를 갖고 있다. 마지막으로 공통적으로 갖고 있을 의문에 말씀 드린다. 어제 논의한 내용을 왜 어제 바로 발표하지 않고 오늘 발표하게 됐느냐는 북한 김정은 위원장 요청에 따른 것이다. 북측의 형평 때문에 오늘 보도할 수 있다고 해서 우리도 오늘 (발표)했으면 좋겠다는 요청을 했다.",Hankyoreh,2018,2018_multi_summit,또 북한이 단계적 동시적 비핵화 해법 말했는데 어제 회담장에서 그와 관련한 보다 진전된 내용이 있었나
inter_korean_summit_0359,"문재인 대통령이 지난 26일 판문점 통일각에서 열린 김정은 북한 국무위원장과의 두 번째 남북정상회담에서 “조미(북미)정상회담이 반드시 성공하기를 기원한다“고 밝혔다. 문 대통령은 판문점 북측 지역 통일각에서 열린 김 위원장과의 제2차 남북 정상회담 마무리 발언에서 이렇게 말했다고 청와대가 27일 밝혔다. 문 대통령은 마무리 발언에서 “과거에는 남북 정상이 마주 앉으려면 아주 길ㄴ 시간 동안 많은 노력이 필요했는데 필요할 때 이렇게 연락해서 쉽게 만날 수 있다는 것이 남북 관계의 새롭ㄴ 시대를 보여 주는 하나의 징표라고 생각한다“며 “앞으로 김 위원장과 함께 남북의 평화 번영을 이끌어 나가기를 바란다“고 말했다. 4.27 남북정상회담 직후 남북 관계에 대해서도 언급했다. 문 대통령은 “지난번 4.27 회담 이후에 남북 간 대화에서도 약간의 어렵ㄴ 과정이 있었고 또 조미(북미)정상회담이라든가 아주 중요한 회담을, 그런 문제들에 대해 함께 협력해 나간다는 그런 의지를 다시 한 번 보여 준다는 차원에서 이번 회담이 아주 뜻 깊었다고 생각한다“고 강조했다.",Hankyoreh,2018,2018_multi_summit,그래서 어제 회담 사실만 먼저 알리고 내용은 오늘 제가 따로 하게 된 점 또 언론에게 양해 말씀 드린다
inter_korean_summit_0360,"문재인 대통령은 27일 “우리 두 정상은 6.12 북미정상회담이 성공적으로 이루어져야 하며, 한반도의 비핵화와 항구적인 평화 체제를 위한 우리의 여정은 결코 중단될 수 없다는 점을 확인하고 이를 위해 긴밀히 상호 협력하기로 했다“고 밝혔다. 문 대통령은 이날 청와대 춘추관에서 열ㄴ 기자 회견을 통해 전날 오후 판문점 북쪽 지역 통일각에서 김정은 북한 국무위원장과 열ㄴ 두 번째 남북정상회담 결과를 직접 발표하며 이같이 말했다. 문 대통령은 전날 김 위원장과 만나 지난 22일 미국 워싱턴에서 열린 한미 정상회담 결과를 직접 설명하면서 “트럼프 대통령은 김 위원장이 완전한 비핵화를 결단하고 실천할 경우, 북한과의 적대 관계 종식과 경제 협력에 대한 확고한 의지가 있다는 점을 전달했다“고 말했다. 잇어 “김 위원장과 트럼프 대통령 모두 북미정상회담의 성공을 진심으로 바라고 있는 만큼 양측이 직접적인 소통을 통해 오해를 불식시키고 정상회담에서 합의해야할 의제에 대해 실무 협상을 통해 충분한 사전 대화가 필요하다는 점을 강조했다“며 “김 위원장도 이에 동의했다“고 덧붙였다. 김 위원장은 “북미정상회담 성공을 통해 전쟁과 대립의 역사를 청산하고 평화와 번영을 위해 협력하겠다“는 의사를 피력했다고 문 대통령은 전했다. 문 대통령은 이날 기자 회견을 통해 전날 열린 두 번째 남북정상회담의 경위도 설명했다. 문 통령은 “김 위원장은 그제(26일) 오후 일체의 형식 없이 만나고 싶다는 뜻을 전해 왔고 저는 흔쾌히 수락했다“며 “지난 4월의 역사적인 판문점 회담 못지않게, 친구 간의 평범한 일상처럼 이루어진 이번 회담에 매우 큰 의미를 부여하고 싶다. 남북은 이렇게 만나야 한다는 것이 제 생각“이라고 말했다. 잇어 “앞으로도 필요할 경우 언제든지 서로 통신하거나 만나 격의 없이 소통하기로 했다“고 말했다. 이와 함께 남북 정상은, 4.27 판문점 선언의 조속한 이행에 합의하면서 새달 1일 남북 고위급 회담을 열기로 합의했다. 또 군사적 긴장 완화를 위한 군사 당국자 회담과 이산가족 상봉을 위한 적십자 회담을 연이어 열기로 합의했다.",Hankyoreh,2018,2018_multi_summit,"문 대통령 “김정은, 만남 먼저 제안 북미 회담 의지 피력“오전 10시 청와대 춘추관에서 전날 회담 직접 발표 “김 위원장에게 회담 성공 바라는 트럼프 진심 전해 비핵화 실천 땐 적대 관계 종식 경제 협력 미 쪽 의지 전달 양쪽 직접 소통으로 오해 불식 충분한 사전 대화 강조“"
inter_korean_summit_0361,"김정은 북한 국무위원장은 26일 문재인 대통령과의 두 번째 정상회담에서 “할 수 있는 최선의 노력을 다해서 결과도 만들고 잘 할 수 있을 것“이라며 남북 북미 관계 진전에 대한 의지를 다시 드러냈다. 김 위원장은 판문점 북측 지역 통일각에서 열린 문 대통령과의 남북정상회담에서 머리 발언과 마무리 발언을 통해 이런 뜻을 내비쳤다고 청와대가 27일 밝혔다. 김 위원장은 29일 만에 문 대통령과 다시 만나 한반도 비핵화 문제, 북/미 정상회담 성공적 개최 등에 관해 의견을 나눈 데 대해 “평화적으로 마음이 모아지고, 평양과 서울이 더 가까워지는 과정이라고 생각한다“고 말했다. 김 위원장은 또 “(문 대통령이) 중요한 문제를 위해 오셨고, 허심탄회하게 대화하고 논의하자고 했는데 각각의 책임하에서 노력해야 할 것으로 생각한다“고 의미를 부여했다. 김 위원장은 문 대통령이 이번 회담을 위해 북쪽 지역으로 온 데 대해 “문 대통령이 북쪽을 찾아오셨는데 이번이 처음이 아니다. 4.27 (남북정상회담) 때도 명장면 중 하나가 (문 대통령이) 10초 동안 (판문점 군사 분계선을 넘어 북쪽으로) 깜짝 넘어 오는 것이었다“고 밝혔다. 김 위원장은 이번 회담이 비공개로 진행된 탓에 문 대통령을 위한 성대한 환영 행사를 하지 못한 것이 마음에 걸리는 듯 “비공개 회담을 하니까 제대로 잘 못 해서 미안한 마음입니다. 평양에 한 번 오시면“이라고 양해를 구했다.",Hankyoreh,2018,2018_multi_summit,김정은 “4.27 명장면은 문 대통령 10초 간 북쪽 넘어 온 것“26일 남북정상회담에서 남북 북미 관계 진전 의지 내비쳐 “할 수 있는 최선 다해 결과 잘 만들ㄹ 것““다시 한 번 대화하고 마음이 가까워지는 과정““문 대통령 북쪽 방문 이번이 처음 아니다“
