doc_id,text,newspaper,year,summit_episode,title
inter_korean_summit_0085,"평화의 집 로비 김: (로비에 걸린 민정기 화백의 '북한산' 그림을 보며) 이것ㄴ 어떤 기법으로 그런 것인가. 문: 서양환데, 우리 동양적 기법으로 그런 것이다. 사전 환담 문: (환담장 뒷벽에 걸린 김중만 작가의 '훈민정음' 소개하며) 이 작품은 세종 대왕이 만들ㄴ 훈민정음의 글씨를 작업한 것이다. 이것을 보면 '서로 사맛디'는 서로 통한다는 뜻이고 글자에 'ㅁ'이 들어가 있다. '맹가노니'는 만들다는 뜻이다. 거기에 'ㄱ'을 특별히 표시했다. 서로 통하게 만들ㄴ다는 뜻이다. 사맛디의 'ㅁ'은 문재인의 미음, 맹가노니의 'ㄱ'은 김정은의 'ㄱ'이다. 김: 세부에까지 마음을 썼다. 문: 여기까지 어떻게 오셨나? 김: 새벽에 차를 이용해 개성을 거쳐 왔다. 대통령께서도 아침 일찍 출발했겠다. 문: 난 불과 52㎞ 떨어져 있어 한 시간 정도 걸렸다 김: 대통령께서 우리 때문에 NSC 참석하느라 새벽 잠 많이 설쳤다는데, 새벽에 일어나는 것이 습관이 됐겠다. 문: 우리 특사단이 갔을 때, 선제적으로 말씀해 줘서 앞으로 발 뻗고 자겠다. 김: 대통령이 새벽 잠 설치지 않도록 내가 확인하겠다. 불과 200m 오면서 왜 이리 멀어 보였을까. 또 왜 이리 어려웠을까 생각했다. 원래 평양에서 대통령을 만날 줄 알았는데 여기서 만난 것이 더 잘됐다. 대결의 상징인 장소에서 많은 사람이 기대를 갖고 보고 있다. 오면서 보니 실향민, 탈북자, 연평도 주민 등 언제 북한 군 포격이 날아 올까 걱정하는 분들도 오늘 우리 만남에 기대하고 있는 것ㄹ 봤다. (청와대 관계자는 “이 부분은 김정은 위원장의 발언으로, 김 위원장이 남측의 언어로 설명한 것“이라고 전했다.) 이 기회를 소중히 해서 남북 상처가 치유되는 계기가 됐으면 한다. 군사 분계선이 높지도 않은데 많은 사람이 밟고 지나다니다 보면 없어지지 않겠나. 문: 도로변에서 많은 주민이 환송해 줬다. 그만큼 우리 만남에 대한 기대가 크다. 대성동 주민들도 나와서 사진 찍었다. 우리 어깨가 무겁다. 오늘 판문점을 시작으로 서울과 평양, 제주도와 백두산으로 만남이 이어졌으면 한다. 문: (장백폭포와 성산 일출봉 그림을 가리키면서) 왼쪽에는 장백 폭포, 오른쪽에는 성산 일출봉 사진이 있다. 김: 나보다 백두산에 대해 더 잘 아는 것 같다. 문: 백두산에 가 본 적이 없다. 중국 쪽으로 백두산 가는 사람이 많다. 나는 북측을 통해서 꼭 백두산에 가 보고 싶다. 김: 대통령이 오면 솔직히 걱정되는 것이 우리 교통이 불비해 불편을 드릴 것 같다. 평창올림픽 다녀온 사람들이 말하는데 평창행 고속 열차가 좋다고 하더라. 남측의 이런 환경에 있다가 북측에 오면 참으로 민망할 수 있겠다. 우리도 준비해서 편하게 올 수 있도록 하겠다. 문: 앞으로 북쪽으로 철도 연결되면 모두가 고속 철도 이용할 수 있다. 이런 것이 6.15, 10.4 합의서에 쓰여 있는데 10년 동안 실천되지 못하았다. 남북 관계가 달라져 그 맥이 끊긴 것이 한스럽다. 김 위원장이 힘써 10년 만에 혈맥을 잇게 됐다. 김: 기대가 큰 만큼 회의적인 시각도 있다. 큰 합의를 해 놓고 10년 동안 실천하지 못하았다. 오늘 만남도 제대로 실천이 되겠냐는 회의적인 시각이 있다. 짧은 거리 오면서 정말 11년이나 걸렸나 생각했다. 11년 동안 못 한 것ㄹ 100여 일 동안 달려 왔다. 굳게 손 잡고 가면 지금보다 나빠질 수 있겠느냐고 생각했다. 김: 여기서 만나면 불편하지 않을까 했는데, 친서와 특사단을 통해 대화를 해 보니 마음이 편했다. 서로 간 신뢰와 믿음이 중요하다.",Chosun Ilbo,2018,2018_multi_summit,문: 그러면 가기 전에 남북 공식 수행원이 기념으로 사진을 함께 찍었으면 좋겠다.(청와대는 이후 예정에 없었던 포토 타임을 가졌다고 설명)
inter_korean_summit_0086,"문: 오늘 주인공은 김 위원장과 나다. 과거 실패를 거울 삼아 잘할 것이다. 과거엔 정권 중간이나 말에 합의가 이루어져, 정권이 바뀌면서 실천이 안 됐다. 나는 1년 차다. 앞으로 속도를 유지했으면 좋겠다. 김: 김여정이 속한 부서에서 '만리마 속도전'이라는 말을 만들었다.",Chosun Ilbo,2018,2018_multi_summit,"문: (김여정 가리키며) 김여정 부부장이 남쪽에서 스타가 됐다. (일동 웃음, 김여정 얼굴 빨개짐)"
inter_korean_summit_0087,"임종석 대통령 비서실장: 살얼음에 안 빠지려면 속도를 늦춰선 안 된다는 말이 있다. 문: 과거 되돌아 봤을 때, 중요한 것ㄴ 속도다. 김 위원장 이제 자주 만나자. 마음을 단단히 먹고 원점 오는 일이 없도록 해야한다. 기대 부응해 좋은 세상 만들자. 앞으로 우리도 잘하겠다. 북측에 큰 사고 있었다고 들었다. 수습하느라 고생이 많았다. 김 위원장이 직접 나서 병원에 가 위로하고, 특별 열차를 배려했다고 들었다. 김: 대결의 역사 종지부 찍자고 왔고 우리 사이에 걸린 문제에 대해 대통령과 무릎을 맞대고 풀려고 왔다. 꼭 좋은 앞 날이 올 것이라 확신하게 됐다. 문: 한반도 문제는 우리가 주인이다. 그러면서도 세계와 함께 가는 우리 민족이 될 것이다. 우리가 이끌고 주변국이 따라올 수 있게 해야 한다. 오전 회담 후 마무리 발언 김: 내가 말씀 드리자면, 고저 비행기로 오시면 제일 편안하시니까, 우리 도로라는 것이, 아까도 말씀 드렸지만 불편합니다. 제가 오늘 내려와 보니까 이제 오시면 이제 공항에서 영접 의식을 하고 이렇게 하면 잘 될 것 같습니다. 문: (웃음) 그 정도는 또 닥쳐서 논의하는 맛도 있어야지요. (웃음) 김: (웃음) 오늘 여기서 다음 계획까지 다 할 필요는 없지요. 문: 아주 오늘 좋은 논의를 많이 이뤄서 아주 우리 남북의 국민들에게, 전 세계 사람들에게 아주 선물이 사람 될 것 같습니다. 김: 많이 기대하셨던 분들한테 물론 이제 시작에, 빙산의 일각에 지나지 않겠지만, 우리 오늘 첫 만남과 오늘 이야기된 것이 발표되고 하면 기대하셨던 분들이 조금이나마 기대를 만족을 드렸으면 하는 바람입니다. 문: 감사합니다. 김: 감사합니다.",Chosun Ilbo,2018,2018_multi_summit,이것ㄹ 남과 북의 통일의 속도로 삼자고 했다. (일동 웃음)
inter_korean_summit_0088,"남북 정상회담이 열리는 판문점 평화의 집 3층 연회장에 백령도의 두무진과 북한 땅인 장산곶을 소재로 한 미술 작품이 걸렸다. 백령도 앞 바다는 2007년 남북정상회담 당시 김정은 국방위원장이 노무현 전 대통령에게 공동 어로 수역을 만들자고 제안하면서 'NLL(북방 한계선) 포기' 논란을 가져온 지역인 데다 두 차례의 연평 해전, 천안함 폭침 사건 등이 있었던 곳이다. 청와대는 “서해를 평화의 보금자리로 만들고자 하는 의미“라고 설명했다. 하지만 공동 어로 수역 평화 수역 조성 문제가 정상회담에서 거론되면 NLL 포기 논란이 재점화될 가능성이 있는 데다, 천안함 폭침에 대해 사과도 받지 못한 상황이어서 논란이 예상된다. 판문점 평화의 집 3층 연회장은 파티션을 쳐서 두 개의 공간으로 나눴다. 오찬에는 우리 측만 참석하지만 김정은 국무위원장을 포함한 북측 대표단이 참석하는 만찬 때는 공간을 터서 한 쪽에서 공연도 할 것으로 예상된다. 연회장 안 단상에는 피아노와 가야금, 드럼 등의 악기가 준비돼 있으며 가야금에는 '은방울'이라는 상표가 붙어 있어 남북 합동 공연이 될 것으로 전망된다. 헤드 테이블 뒤에는 신태수 작가의 '두무진에서 장산곶'이 걸렸다. 가로 430, 세로 130 한지에 먹으로 그린 작품으로 북한과 마주한 서해 최북단 백령도 해안가를 묘사했다. 신 작가는 백령도 연평도 등 서해 5도를 비롯해 서해 여러 섬의 풍광을 화폭에 즐겨 담은 것으로 알려졌다. 특히 신 작가는 백령도 평화 예술 프로젝트를 통해 2012년부터 3년 동안 백령도를 오가며 다양한 작품을 남겼다. 청와대 관계자는 이 작품을 선정한 이유로 “북한과 마주하고 있는 서해의 최전방 백령도에서 분쟁의 상징이었던 서해를 평화의 보금자리로 만들고자 하는 의도로 선정했다“고 설명했다. 두무진과 장산곶 앞 바다는 지난 2007년 남북 정상회담 당시 김정일이 '서해 공동 어로 수역'을 제안하면서 NLL 포기 논란이 있었던 곳이다. 이재정 전 통일부 장관은 27일 CBS 김현정의뉴스쇼에서 “김정일이 먼저 서해를 평화 수역으로 하자며 공동 어로 구역을 제안했다“며 “그 곳을 군대가 아닌 경찰이 지키도록 하자고도 먼저 말했다“고 전했다. 국정원이 2013년 6월 공개한 정상회담 대화록에서도 김정일은 “우리가 주장하는 군사 경계/ 선(해상 분계 선), 또 남측이 주장하는 북방 한계선(NLL), 이것 사이에 있는 수역을 공동 어로 구역 아니면 평화 수역으로 설정하면 어떻겠나“라고 한 것으로 전해졌다. 북의 해상 분계 선은 NLL보다 훨씬 남쪽에 그어져 있기 때문에 공동 어로 구역을 NLL 남쪽에 설정하자는 것으로 풀이됐다. 이번 정상회담에서도 서해 공동 어로 구역 평화 수역 설정이 의제로 오르면 'NLL 포기' 논란이 다시 일어날 가능성이 크다. 또 서해 5도는 두 차례의 연평 해전과 천안함 폭침이 있었던 곳이다. 민군합동조사단 조사 결과 천안함 폭침이 북한 정찰총국의 소행인 것으로 밝혀지면서, 당시 정찰총국장이었던 김영철이 천안함 폭침의 주범으로 지목됐다. 최근 통일부는 ""천안함 폭침을 명백한 북한의 군사적 도발로 간주한다“면서도 “김영철이 천안함 공격을 주도했다고 단언하기는 어렵다“는 입장을 밝힌 바 있다. 국방부도 “그 당시 (김영철이 주범일)가능성이 있다고 얘기한 것이고 공식 결론을 내린 것은 아니다“라고 밝힌 바 있다. 혼게이자이 “김정은 일정 지킨 것 놀랍다 서프라이즈 연출도“일본 니혼게이자이신문은 27일 남북 정상회담을 위해 판문점에 온 김정은 북한 국무위원장이 한국 측이 미리 발표 한 일정을 거의 지킨 것은 이례적이라고 평했다. 이 신문은 김정은이 이날 오전 예정된 9시 30 분 전에 모습을 드러내고 일정에 따라 도보로 회담 장손 남측 평화의 집으로 이동했다고 전했다. 이에 대해 이 신문은 “독재자는 암살 등을 우려해 사전에 정해진 예정대로 행동하지 않는 것이 통례“라며 “(이날 김정은 행보에) 각국의 외교단에서 놀라움의 소리가 커졌다“고 전했다. 신문이 인용한 서방 외교 소식통은 “남북의 신뢰 관계가 강하다는 표현“이라고 분석했다. 이날 문재인 대통령이 김정은의 제안에 따라 군사 분계선 북쪽으로 잠시 넘어 간 데 대해 주요 외신은 큰 의미를 부여했다. 니혼게이자이는 “판문점에서 김정은은 일단 남쪽에 발을 디딘 후 문 대통령과 손을 잡고 경계(군사 분계선)를 넘어 북쪽에 들어갔다가 다시 함께 남쪽으로 넘어 갔다“며 “몇 번이나 경계를 넘는 서프라이즈는 남북을 가르는 장벽을 극복할 수 있다는 의미를 담은 연출의 일환으로 풀이된다“고 전했다. 이날 한국 군 현역 군인 중 최고위직인 정경두 합참의장(공군 대장)은 환영 행사에서 김정은에게 거수경례를 하지 않고 악수만 했다. 정복을 입은 군인은 실외에서 거수경례로 인사를 하는 것이 원칙이지만, 이날 정복을 입고 나온 정 의장은 김정은에게 거수경례를 하지 않았다. 정 의장의 거수경례 여부를 두고 회담 전부터 관심이 모였다. 니혼게이자이는 김정은이 한국 군의 의장대를 사열한 것에 대해 “한국 군이 적인 북한의 지도자에 경례하는 것도 이번이 처음“이라고 전했다. 김정은 “수시로 만나“...",Chosun Ilbo,2018,2018_multi_summit,천안함 폭침 사과도 못 받았는데 백령도 그림 앞에서 만찬 예정
inter_korean_summit_0089,"김정은 북한 국무위원장은 27일 판문점 남측 평화의 집에서 열린 문재인 대통령과의 남북정상회담 모두 발언에서 정상회담 정례화에 대한 의지를 밝혔다. 김정은은 취재진에 공개된 모두 발언에서 “수시로 만나서 문제를 풀면 우리가 잃어 버린 11년이 아깝지 않게 좋게 나가지 않을까 생각하면서 만감이 교차하는 마음으로 200m를 걸어 왔다“고 했다. '수시로 만나자'는 김정은의 발언은 이번 회담을 계기로 남북정상회담 정례화가 합의될 수 있음을 예감하게 한다. 양 정상이 정상회담 정례화에 합의할 경우, 정상회담 장소로는 판문점이 유력하게 꼽힌다. 이와 관련, 문재인 대통령도 모두 발언에서 “김 위원장이 사상 최초로 군사 분계 점을 넘어 오는 순간 판문점은 분단이 아닌 평화의 상징이 됐다“고 말했다. 김정은은 이와 함께 2007년 남북정상회담 이후를 ‘잃어 버린 11년'이라 통칭했다. 이는 이명박 박근혜 정부의 집권 기간을 ‘잃어 버린 시간'으로 규정짓은 것으로 보인다. 이와 관련, 일각에서는 남 남 갈등을 조장하는 발언이 아니냐는 분석을 내놓고 있다. 김정은이 만찬 메뉴를 설명하면서 자신들의 정성을 표현하기 위해 '멀리서 가져왔다'고 했다가 '멀지는 않구나'라고 정정한 대목도 눈에 띈다. 김정은은 “어렵사리 평양에서 평양냉면을 가져왔다. 대통령께서 편한 마음으로 멀리서 온, 멀다 하면 안 되겠구나. 좀 맛있게 먹었으면 좋겠다“고 했다. 이는 서울과 평양이 멀지 않다는 의미로 '미소 외교'의 일환으로 읽힌다. 아울러 김정은은 두 정상 간 허심탄회한 대화와 통 큰 결단에 대한 의지도 피력했다. 김정은은 “오늘 현안 문제들, 관심사 되는 문제들을 툭 터 놓고 이야기하고 좋은 결과를 만들어 내자“고 했다. 이에 대해 문 대통령은 “통 크게 대화를 나누고 합의에 일러서 평화를 바라는 모든 사람에게 큰 선물을 만들어 줬으면 한다“고 화답했다.",Chosun Ilbo,2018,2018_multi_summit,남북정상회담 정례화 시사 “수시로 만나““잃어 버린 11년“
inter_korean_summit_0090,"27일 오전 9시 30분 문재인 대통령과 김정은 국무위원장이 군사 분계선(MDL)에서 만나는 순간 취재진이 모여 있는 메인 프레스 센터(이하 MPC)엔 박수와 환호성이 터졌다. 특히 문재인 대통령과 김정은 위원장이 손을 잡고 걷어 갈 때와, '평양냉면 발언' 등 예상하지 못한 에피소드가 나왔을 때는 흐뭇한 표정으로 MPC에 설치된 스크린을 바라보기도 했다. 러시아 통신사 ITAR/TASS의 이고르 벨랴예프는 “문재인 대통령이 군사 분계선을 넘어 간 것을 보고 깜짝 놀라 머리 위로 박수를 쳤다“며 “전혀 예상하지 못하았지만 남한과 북한의 친근함를 나타내는 것 같아서 상황을 지켜 보는 내내 웃음 지었다“고 말했다. 한편, 고양시 킨텍스에 설치된 메인 프레스 센터(MPC)엔 2018 남북 정상회담을 취재하기 위해 37개국 3000여 명의 기자가 모여 있다.",Chosun Ilbo,2018,2018_multi_summit,"문 대통령, 김 위원장 만나는 순간 외신 기자들의 반응"
inter_korean_summit_0091,"북한이 27일 열린 남북 정상회담에 앞서 당 간부들을 대상으로 “김정은 북한 노동당 위원장이 인민을 위해 목숨을 걸고 혼자 남쪽에 간다“고 선전했다고 일본 아사히 신문이 북한 소식통을 인용해 이날 보도했다. 소식통은 3월 말쯤 북한의 당 간부들을 대상으로 배포된 한 교육 자료에 “원수님이 38선을 넘어 남측에 내려간다“고 적혀 있다고 전했다. 김정은이 회담을 위해 군사 분계선을 넘어 남측 평화의 집으로 걷어 가는 것을 “용기 있는 결단“이라고 추켜 세우었다고도 전했다. 아사히는 “(김정은의) 조분 김일성 주석과 아버지 김정일 국방위원장이 이루지 못한 남측 방문의 의의를 강조해 김정은을 신격화한 것으로 보인다“고 분석했다. 소식통은 북한이 판문점 회담장으로 떠나는 김정은을 북한 주민들이 개성시에서부터 도로에 서서 환송하는 방안을 검토했다고도 전했다. 그러나 당국은 도로가 좁고 지뢰의 위험이 있어 신중한 자세를 보인 것으로 전해져, 실제 북한 주민들의 배웅이 있었는지는 확인되지 않았다. 또 다른 소식통은 김정은이 남북 정상회담 개최지로 판문점을 직접 요구했다고 전했다. 한국의 대북 특사단이 지난달 초 방북해 서울 제주 판문점 평양을 후보지로 제안했으나 김정은이 판문점을 요구했다는 것이다.",Chosun Ilbo,2018,2018_multi_summit,"“김정은, 인민 위해 목숨 걸고 남한 간다“北 내부 선전"
inter_korean_summit_0092,"CCtv 신화통신 등 중국 매체들도 27일 남북정상회담 소식을 현장 생중계로 내보내며 '역사적““처음“이라는 표현을 자주 사용했다. CCtv는 김정은 북한 국무위원장이 군사 분계선을 사이에 두고 문재인 대통령과 악수한 뒤 한국으로 넘어 와 국군 의장대를 사열하는 모습을 보여 주며 곳곳에 역사적인 순간이 있었다고 전했다. 문 대통령이 김 위원장의 요청으로 잠시 북쪽 땅을 밟고 악수하는 모습도 부각시켰다. 양국 관계의 특수성을 감안해 국기 게양은 하지 않았다고 전하기도 했다. CCtv 신화통신 중국 매체는 정상회담 수식어로 남북을 의미하는 '한 조(韓朝)'와 북남을 의미하는 '조 한(朝韓)'을 섞어 사용했다. CCtv는 김 위원장이 방명록에 적은 “새롭ㄴ 력사(역사)는 이제부터. 평화의 시대, 력사(역사)의 출발점에서“이라는 문구를 소개하고, 남북 정상의 모두 발언도 현장 화면과 함께 전했다. CCtv는 앞서 이날 아침 뉴스에서 한국 시간 오전 8시 5분 문 대통령이 청와대를 나와 회담장인 판문점으로 출발했다면서 현장 영상을 보도했다. CCtv는 서울과 평양에 있는 기자를 연결해 회담장 주변 분위기와 한국 시민 반응 등도 소개했다. 임진각 현장 스튜디오에 나간 CCtv 앵커 수이쥔이는 두 정상의 동선을 소개하면서 남북 간 민간 교류 확대도 기대하고 있다고 분위기를 전했다. 환구시보는 회담 일정과 두 정상의 동선을 그래픽으로 만들어 소개하기도 했다. CCtv는 2000년과 2007년 각각 당시 김대중 대통령과 노무현 대통령이 김정일 국방위원장과 만난 남북 정상회담 역사를 짚기도 했다. 또 윤영관 전 외교 통상부 장관 등과의 인터뷰를 통해 평화를 정착시키는 문이 열렸다고 의미를 부여했다. “한반도 비핵화를 위한 중요한 스텝“이라는 유엔 대변인의 논평을 전하기도 했다. 이날 오전 현재 중국 정부의 공식 반응은 없지만 화춘잉(華春瑩) 외교부 대변인은 전날 오후 정례 브리핑에서 “남북 정상회담에서 양국이 성공을 거두기를 희망한다“며 “한반도 문제에서 계속 좋은 소식이 들려 오고 또 이를 통해 문제 해결의 올바른 길이 열리기를 바란다“고 기대했다. 남북정상회담, 오전 회담 종료 개별 오찬 문재인 대통령과 북한 김정은 국무위원장의 27일 오전 회담이 종료됐다. 김정은은 회담 종료 직후 자신의 벤츠 차량을 타고 판문점 북측 지역으로 이동했다. 문 대통령과 김정은은 개별 오찬을 가지면서 참모들과 오전 회담을 평가하고, 오후 회담을 준비할 예정이다. 평양냉면 맛본 CNN 앵커 “국수로 하나 되는 한반도“미국 CNN는 26일(현지 시각) 남북 정상회담 저녁 만찬에 오르는 평양 옥류관 냉면을 소개하며 '국수 외교(noodle diplomacy)'라고 표현했다. 진행자들이 스튜디오에서 직접 냉면 맛을 보면서 “냉면이 남북 간 '음식 외교'에서 상당히 중요한 부분을 차지한다“고 전했다. CNN는 이날 남북 정상회담 특별 방송 중 '바람아멈추어다오'를 부른 한국 가수 이지연을 초청해 스튜디오에서 직접 평양냉면의 맛을 재현해 달라고 했다. 2007년부터 미국에서 요리사로 활동하는 이지연은 “이북에서 살던 조부모에게 평양냉면 만드는 법을 전수 받았다“며 평양식 동치미 냉면을 만들어 선 보였다. 진행자들은 이지연의 냉면을 맛본 뒤 “맛 있다”고 극찬했다. CNN는 평양냉면이 남북 정상회담에서 교량 역할을 하는 음식이라고 강조했다. 보통 미국에서 냉면을 '차갑ㄴ 국수(cold noodle)'이라고 표기하는 것과 다르게 자막에 원음 그대로 '평양냉면(Pyongyang NaengmyUN)'이라고 썼다. 김정은 북한 노동당 위원장은 27일(한국 시각) 오전 10시 15분 시작된 남북 정상회담 모두 발언 중 “오늘 저녁 만찬 음식에 대한 이야기가 많던데, 멀리서 평양냉면을 가져왔다“며 “문재인 대통령이 맛있게 드셔 주셨으면 좋겠다“고 말했다. 만찬 음식이 평양냉면으로 정해진 것은 문재인 대통령이 지난 24일 “(북한 식당) 옥류관 평양냉면이 좋겠다“고 제안하면서다. 북측은 다음 날 평양 옥류관 수석 요리사를 판문점에 파견하고, 옥류관 제면기를 통일각에 설치했다. 통일각에서 뽑아 낸 냉면을 정상회담 장손 평화의 집으로 배달해 옥류관 냉면의 맛을 그대로 살릴 예정이다. 北 군 수뇌부는 文 대통령에 '거수경례' 南 합참의장은 김정은에 '악수' 판문점에서 27일 열린 '2018 남북정상회담' 환영 행사에서는 공식 수행원으로 참가한 양측 군 수뇌부 인사들의 경례 장면이 대조됐다. 우리 군 현역 군인 중 최고위직인 정경두 합참의장은 이날 김정은 국무위원장과 인사를 하면서 거수경례를 하지 않고 악수만 했다. 정복을 입은 현역 군인은 실외에서는 거수경례로 인사하는 것이 원칙이다. 하지만 천안함 폭침 사건과 연평도 포격 등 각종 도발을 저질러 온 북한 최고 지도자에게 우리 군 서열 1위가 거수경례를 하는 것이 적절하냐는 지적이 나왔고, 정 합참의장도 이와 같은 시각을 의식해 거수경례를 하지 않은 것으로 알려졌다. 반면, 문재인 대통령과 인사를 나눈 리명수 북한 인민군 총참모장과 박영식 인민 무력상은 거수경례한 후 악수했다. 리명수와 박영식은 북한 군부의 '투톱'이다. 리명수는 우리나라 합참의장 급으로 북한 군부 서열 2위다. 박영식은 우리나라의 국방부 장관 격으로 북한 군부 서열 3위다. 김정은 체제에서 가장 오래 현직에 머무르고 있는 군부 인사 중 한 명으로 2015년 6월에 임명된 후 3년째 자리를 지키고 있다. 군 관계자는 “우리 측은 북한으로부터 천안함 폭침 등의 사과를 받지 못한 상황에서 김정은에게 예우를 갖추기 어렵ㄴ 상황이었다“며 “반면, 천안함 폭침 등을 인정하지 않는 북한으로서는 '정상 국가'임를 과시하며 여유를 부린 것“이라고 했다.",Chosun Ilbo,2018,2018_multi_summit,중국 CCtv “남북 정상회담 곳곳 역사적 순간“
